Source,Name,"Main Phone","Main Email",Website,"Website Valid","Email extension",Linkedin,Instagram,Facebook,X,Pinterest,TikTok,Youtube,Mission,"Veteran Owned Business Y/N","Is certified Veteran Owned Business Y/N","Is Veteran Service Organization Y/N","Is VA or GOV Organization Y/N","VA or GOV Type","VA or GOV Subtype","Service Area","Address Line one","Address Line Two",Latitude,Longitude,"Zip Code",Country,State,County,"Municipality - Place",Notes,Owner,"Owner Phone","Owner Email"
https://www.afvbc.com/afvbc-uk-breakfast-clubs,"Aberdeen Armed Forces & Veterans Breakfast Clubs",,,,,,,,,,,,,,,,,,,,,,"Ghillies Lair                         The Great Southern Road                    Bridge of Dee                    AB12 5XA                    United Kingdom",,,"AB12 5XA","United Kingdom",,,"Aberdeen City",,,,
https://www.afvbc.com/afvbc-uk-breakfast-clubs,"Addington Armed Forces Veterans Breakfast Club",,,,,,,,,,,,,,,,,,,,,,"The Cricketers                         36 Addington Village Road                    Addington                    Croydon                    CR0 5AQ                    United Kingdom",,,"CR0 5AQ","United Kingdom",,,Croydon,,,,
https://www.afvbc.com/afvbc-uk-breakfast-clubs,"Aldershot Armed Forces & Veterans Breakfast Clubs",,,,,,,,,,,,,,,,,,,,,,"JD Weatherspoons                         Queen Hotel                    1 High Street                    Aldershot, Hants                    GU11 1BH                    United Kingdom",,,"GU11 1BH","United Kingdom",,,Rushmoor,,,,
https://www.afvbc.com/afvbc-uk-breakfast-clubs,"Allenton Armed Forces & Veterans Breakfast Clubs",,,,,,,,,,,,,,,,,,,,,,"The Merlin                         1 Orient Way                    Pride Parkway                    Derby                     DE24 8XL                    United Kingdom",,,"DE24 8XL","United Kingdom",,,Derby,,,,
https://www.afvbc.com/afvbc-uk-breakfast-clubs,"Alloa (Scotland) Armed Forces & Veterans Breakfast Clubs",,,,,,,,,,,,,,,,,,,,,,"The Bobbing John                         46 Drysdale Street                    Alloa                    FK10 1JL                    United Kingdom",,,"FK10 1JL","United Kingdom",,,Clackmannanshire,,,,
https://www.afvbc.com/afvbc-uk-breakfast-clubs,"Alresford Armed Forces & Veterans Breakfast Clubs",,,,,,,,,,,,,,,,,,,,,,"Arlebury Cafe                         Arlebury Park                     The Avenue                    New Alresford                    SO24 9EP                    United Kingdom",,,"SO24 9EP","United Kingdom",,,Winchester,,,,
https://www.afvbc.com/afvbc-uk-breakfast-clubs,"Andover Armed Forces & Veterans Breakfast Clubs",,,,,,,,,,,,,,,,,,,,,,"Too Fast Too Filling                         Commercial Centre                    Picket Piece                    Andover                    SP11 6RU                    United Kingdom",,,"SP11 6RU","United Kingdom",,,"Test Valley",,,,
https://www.afvbc.com/afvbc-uk-breakfast-clubs,"Annandale Armed Forces & Veterans Breakfast Clubs",,,,,,,,,,,,,,,,,,,,,,"Annan Athletic Football Club                         Galabank                    North Street                    Annan                    DG12 5DQ                    United Kingdom",,,"DG12 5DQ","United Kingdom",,,"Dumfries and Galloway",,,,
https://www.afvbc.com/afvbc-uk-breakfast-clubs,"Antrim Armed Forces & Veterans Breakfast Clubs",,,,,,,,,,,,,,,,,,,,,,"The Antrim Masonic Hall                         68-70 Church Street                    Antrim                    Northern Ireland                    BT41 4BA                    United Kingdom",,,"BT41 4BA","United Kingdom",,,"Antrim and Newtownabbey",,,,
https://www.afvbc.com/afvbc-uk-breakfast-clubs,"Arbroath Armed Forces & Veterans Breakfast Clubs",,,,,,,,,,,,,,,,,,,,,,"The Anchor Bar                         18 West Port                    Arbroath                    DD11 1RE                    United Kingdom",,,"DD11 1RE","United Kingdom",,,Angus,,,,
https://www.afvbc.com/afvbc-uk-breakfast-clubs,"Ashby-de-la-zouch Armed Forces & Veterans Breakfast Clubs",,,,,,,,,,,,,,,,,,,,,,"The White Hart                         Market Street                    Ashby-De-La-Zouch                    Leicestershire                    LE65 1AP",,,"LE65 1AP","United Kingdom",,,"North West Leicestershire",,,,
https://www.afvbc.com/afvbc-uk-breakfast-clubs,"Ashford (Kent) Armed Forces & Veterans Breakfast Clubs",,,,,,,,,,,,,,,,,,,,,,"County Hotel (Wetherspoons)                         10 High Street                    Ashford                    Kent                    TN24 8TD                    United Kingdom",,,"TN24 8TD","United Kingdom",,,Ashford,,,,
https://www.afvbc.com/afvbc-uk-breakfast-clubs,"Ashford (North) Armed Forces & Veterans Breakfast Clubs",,,,,,,,,,,,,,,,,,,,,,"The Bybrook Barn Harvester                         Canterbury Road                    Kennington                    Ashford                    TN24 8QQ                    United Kingdom",,,"TN24 8QQ","United Kingdom",,,Ashford,,,,
https://www.afvbc.com/afvbc-uk-breakfast-clubs,"Aylesbury Armed Forces & Veterans Breakfast Clubs",,,,,,,,,,,,,,,,,,,,,,"The White Hart                         Exchange Street                    Aylesbury                    HP20 1UR                    United Kingdom",,,"HP20 1UR","United Kingdom",,,Buckinghamshire,,,,
https://www.afvbc.com/afvbc-uk-breakfast-clubs,"Aylesford & Maidstone Armed Forces & Veterans Breakfast Clubs",,,,,,,,,,,,,,,,,,,,,,"Malta Inn (Beefeater)                         Forstal Road                    Allington Lock, Sandling                    Maidstone, Kent                    ME14 3AS                    United Kingdom",,,"ME14 3AS","United Kingdom",,,Maidstone,,,,
https://www.afvbc.com/afvbc-uk-breakfast-clubs,"Ayr Armed Forces & Veterans Breakfast Clubs",,,,,,,,,,,,,,,,,,,,,,"Nanny Marys Diner                         42 Smith Street                    Ayr                     KA7 1TF                    United Kingdom",,,"KA7 1TF","United Kingdom",,,"South Ayrshire",,,,
https://www.afvbc.com/afvbc-uk-breakfast-clubs,"Ayrshire (Irvine) Armed Forces & Veterans Breakfast Clubs",,,,,,,,,,,,,,,,,,,,,,"The Carrick                         112-114 High Street                    Irvine                    KA12 8AD                    United Kingdom",,,"KA12 8AD","United Kingdom",,,"North Ayrshire",,,,
https://www.afvbc.com/afvbc-uk-breakfast-clubs,"Bakewell Armed Forces & Veterans Breakfast Clubs",,,,,,,,,,,,,,,,,,,,,,"The Farmers Feast                         The Agricultural Business Centre                     Agricultural Way                    Bakewell                    DE45 1AH                    United Kingdom",,,"DE45 1AH","United Kingdom",,,"Derbyshire Dales",,,,
https://www.afvbc.com/afvbc-uk-breakfast-clubs,"Banbury Armed Forces & Veterans Breakfast Clubs",,,,,,,,,,,,,,,,,,,,,,"The Exchange (Wetherspoon)                         49-50 High Street                    Banbury                    Oxon                    OX16 5LA                    United Kingdom",,,"OX16 5LA","United Kingdom",,,Cherwell,,,,
https://www.afvbc.com/afvbc-uk-breakfast-clubs,"Bardney Armed Forces & Veterans Breakfast Clubs",,,,,,,,,,,,,,,,,,,,,,"The Old Angel Inn                         2 Wragby Road                    Bardney                    Lincoln                     LN3 5XE                    United Kingdom",,,"LN3 5XE","United Kingdom",,,"West Lindsey",,,,
https://www.afvbc.com/afvbc-uk-breakfast-clubs,"Barnsley Armed Forces & Veterans Breakfast Clubs",,,,,,,,,,,,,,,,,,,,,,"Manx Arms                         32 Sheffield Road                    Barnsley                    South Yorkshire                    S70 1HP                    United Kingdom",,,"S70 1HP","United Kingdom",,,Barnsley,,,,
https://www.afvbc.com/afvbc-uk-breakfast-clubs,"Barnstaple Armed Forces & Veterans Breakfast Clubs",,,,,,,,,,,,,,,,,,,,,,"The Corner Cafe                         1 Boutport Street                    Barnstaple                    Devon                    EX31 1RH                    United Kingdom",,,"EX31 1RH","United Kingdom",,,"North Devon",,,,
https://www.afvbc.com/afvbc-uk-breakfast-clubs,"Barrow-in-Furness Armed Forces & Veterans Breakfast Clubs",,,,,,,,,,,,,,,,,,,,,,"Ferry Hotel                         1 Promenade                    Wainey                    Barrow-in-Furness                    LA14 3PE                     United Kingdom",,,"LA14 3PE","United Kingdom",,,"Westmorland and Furness",,,,
https://www.afvbc.com/afvbc-uk-breakfast-clubs,"Barton-upon-Humber Armed Forces & Veterans Breakfast Clubs",,,,,,,,,,,,,,,,,,,,,,"Barton Town Cricket Club                         Marsh Lane                    Barton upon Humber                    North Lincolnshire                    DN18 5JD                    United Kingdom",,,"DN18 5JD","United Kingdom",,,"North Lincolnshire",,,,
https://www.afvbc.com/afvbc-uk-breakfast-clubs,"Basildon Armed Forces & Veterans Breakfast Clubs",,,,,,,,,,,,,,,,,,,,,,"The Campenile Hotel                         Miles Grey Road                    Pipps Hill                    Basildon                    SS14 3AE                    United Kingdom",,,"SS14 3AE","United Kingdom",,,Basildon,,,,
https://www.afvbc.com/afvbc-uk-breakfast-clubs,"Bedale Armed Forces & Veterans Breakfast Clubs",,,,,,,,,,,,,,,,,,,,,,"Bridge Cafe                         Bedale                    North Yorkshire                    DL8 1AN                    United Kingdom",,,"DL8 1AN","United Kingdom",,,"North Yorkshire",,,,
https://www.afvbc.com/afvbc-uk-breakfast-clubs,"Bedford Armed Forces & Veterans Breakfast Clubs",,,,,,,,,,,,,,,,,,,,,,"RAFA Branch Club                         93 Ashburnham Road                    Bedford                     MK40 1EA                    United Kingdom",,,"MK40 1EA","United Kingdom",,,Bedford,,,,
https://www.afvbc.com/afvbc-uk-breakfast-clubs,"Bedford (North) Armed Forces & Veterans Breakfast Clubs",,,,,,,,,,,,,,,,,,,,,,"North End Social Club                         60 Roff Avenue                    Bedford                    MK 41 7TW                    United Kingdom",,,,"United Kingdom",,,,,,,
https://www.afvbc.com/afvbc-uk-breakfast-clubs,"Beverley Armed Forces & Veterans Breakfast Clubs",,,,,,,,,,,,,,,,,,,,,,"The Angel                         15 Butcher Row                    Beverley                    HU17 0AA",,,"HU17 0AA","United Kingdom",,,"East Riding of Yorkshire",,,,
https://www.afvbc.com/afvbc-uk-breakfast-clubs,"Bexley Heath (S/E London) Armed Forces & Veterans Breakfast Clubs",,,,,,,,,,,,,,,,,,,,,,"The Falcon                         Lingfield Cres                    London                    Bexley                    SE9 2RD                    United Kingdom",,,"SE9 2RD","United Kingdom",,,Greenwich,,,,
https://www.afvbc.com/afvbc-uk-breakfast-clubs,"Biggar Armed Forces & Veterans Breakfast Clubs",,,,,,,,,,,,,,,,,,,,,,"Aroma Cafe Biggar                         86 High Street                    Biggar                    South Lanarkshire                    ML12 6DH                    United Kingdom",,,"ML12 6DH","United Kingdom",,,"South Lanarkshire",,,,
https://www.afvbc.com/afvbc-uk-breakfast-clubs,"Biggin Hill Armed Forces Veterans Breakfast Clubs",,,,,,,,,,,,,,,,,,,,,,"The Spitfire Cafe                         154A Main Road                    Biggin Hill                    TN16 3BA                    United Kingdom",,,"TN16 3BA","United Kingdom",,,Bromley,,,,
https://www.afvbc.com/afvbc-uk-breakfast-clubs,"Biggleswade Armed Forces & Veterans Breakfast Clubs",,,,,,,,,,,,,,,,,,,,,,"The White Hart                         22-24 Market Square                    Biggleswade                    Bedfordshire                    SG18 8AR                    United Kingdom",,,"SG18 8AR","United Kingdom",,,"Central Bedfordshire",,,,
https://www.afvbc.com/afvbc-uk-breakfast-clubs,"Billingborough Armed Forces & Veterans Breakfast Clubs",,,,,,,,,,,,,,,,,,,,,,"Fortescue Arms                         27 High Street                    Billingborough                    Lincolnshire                    NG34 0QB                    United Kingdom",,,"NG34 0QB","United Kingdom",,,"South Kesteven",,,,
https://www.afvbc.com/afvbc-uk-breakfast-clubs,"Bingham & District Armed Forces Veterans Breakfast Clubs",,,,,,,,,,,,,,,,,,,,,,"The Butter Cross (Wetherspoon)                         Market Place                    Bingham                    Nottinghamshire                    NG13 8AP                    United Kingdom",,,"NG13 8AP","United Kingdom",,,Rushcliffe,,,,
https://www.afvbc.com/afvbc-uk-breakfast-clubs,"Birmingham Armed Forces & Veterans Breakfast Clubs",,,,,,,,,,,,,,,,,,,,,,"Weoley Castle Inn                         112 Shenley Lane                    Birmingham                    B29 5LX                    United Kingdom",,,"B29 5LX","United Kingdom",,,Birmingham,,,,
https://www.afvbc.com/afvbc-uk-breakfast-clubs,"Birmingham (North) Armed Forces & Veterans Breakfast Clubs",,,,,,,,,,,,,,,,,,,,,,"The Malt Shovel                         Newton Road                    Great Barr                    Birmingham                    B43 6HN                    United Kingdom",,,"B43 6HN","United Kingdom",,,Sandwell,,,,
https://www.afvbc.com/afvbc-uk-breakfast-clubs,"Bishop&#039;s Stortford Armed Forces & Veterans Breakfast Clubs",,,,,,,,,,,,,,,,,,,,,,"The Port Jackson                         Riverside Wharf                    Ground Floor Units D1/D2, Block D                    Riverside, Bishop&#039;s Stortford                    CM23 3GN                    United Kingdom",,,"CM23 3GN","United Kingdom",,,"East Hertfordshire",,,,
https://www.afvbc.com/afvbc-uk-breakfast-clubs,"Bishops Cleeve Armed Forces & Veterans Breakfast Clubs",,,,,,,,,,,,,,,,,,,,,,"Royal Oak                         Church Road                    Bishops Cleeve                    Cheltenham                    GL52 8LR                    United Kingdom",,,"GL52 8LR","United Kingdom",,,Tewkesbury,,,,
https://www.afvbc.com/afvbc-uk-breakfast-clubs,"Blackburn & Darwen Armed Forces & Veterans Breakfast Clubs",,,,,,,,,,,,,,,,,,,,,,"Blackburn Youth Zone                         Jubilee Street                    Blackburn                    BB1 1EP                    United Kingdom",,,"BB1 1EP","United Kingdom",,,"Blackburn with Darwen",,,,
https://www.afvbc.com/afvbc-uk-breakfast-clubs,"Blackpool Armed Forces & Veterans Breakfast Clubs",,,,,,,,,,,,,,,,,,,,,,"The Belle Vue                         Whitefgate Drive                    Blackpool                    FY3 9DQ                    United Kingdom",,,"FY3 9DQ","United Kingdom",,,Blackpool,,,,
https://www.afvbc.com/afvbc-uk-breakfast-clubs,"Blandford Armed Forces & Veterans Breakfast Clubs",,,,,,,,,,,,,,,,,,,,,,"Clubhouse 1896                         Ashley Wood Golf Club                    Blandford Forum                     Dorset                    DT11 9HN                    United Kingdom",,,"DT11 9HN","United Kingdom",,,Dorset,,,,
https://www.afvbc.com/afvbc-uk-breakfast-clubs,"Bodmin Armed Forces & Veterans Breakfast Clubs",,,,,,,,,,,,,,,,,,,,,,"The Lanivet Inn                         Truro Road                    Lanivet                    Bodmin, Cornwall                    PL30 5ET                    United Kingdom",,,"PL30 5ET","United Kingdom",,,Cornwall,,,,
https://www.afvbc.com/afvbc-uk-breakfast-clubs,"Bognor Regis Armed Forces & Veterans Breakfast Clubs",,,,,,,,,,,,,,,,,,,,,,"Laburnum Centre & Gym (AGE UK)                         Lyon St                    Bognor Regis                    PO21 1UX                    United Kingdom",,,"PO21 1UX","United Kingdom",,,Arun,,,,
https://www.afvbc.com/afvbc-uk-breakfast-clubs,"Bolton Armed Forces & Veterans Breakfast Clubs",,,,,,,,,,,,,,,,,,,,,,"A & J&#039;s Café                         Eagle Street                    Haulgh                    Bolton                    BL2 2BU                    United Kingdom",,,"BL2 2BU","United Kingdom",,,Bolton,,,,
https://www.afvbc.com/afvbc-uk-breakfast-clubs,"Bootle Armed Forces & Veterans Breakfast Clubs",,,,,,,,,,,,,,,,,,,,,,"PSI Global Training                         Unit 10                    D B R Business Park                    Dunnings Bridge Road                    L30 6AA                    United Kingdom",,,"L30 6AA","United Kingdom",,,Sefton,,,,
https://www.afvbc.com/afvbc-uk-breakfast-clubs,"Bordon Armed Forces & Veterans Breakfast Clubs",,,,,,,,,,,,,,,,,,,,,,"Café 1759                         Chieftain House                    Challenger Place                    GU35 0FP                    United Kingdom",,,"GU35 0FP","United Kingdom",,,"East Hampshire",,,,
https://www.afvbc.com/afvbc-uk-breakfast-clubs,"Boston Armed Forces & Veterans Breakfast Clubs",,,,,,,,,,,,,,,,,,,,,,"Spirit Of Endeavour                         Marsh Lane                    Boston                    PE21 7QS                    United Kingdom",,,"PE21 7QS","United Kingdom",,,Boston,,,,
https://www.afvbc.com/afvbc-uk-breakfast-clubs,"Bourne Armed Forces & Veterans Breakfast Clubs",,,,,,,,,,,,,,,,,,,,,,"The Nags Head                         2 Abbey Road                    Bourne                    Lincs                    PE10 9EF                    United Kingdom",,,"PE10 9EF","United Kingdom",,,"South Kesteven",,,,
https://www.afvbc.com/afvbc-uk-breakfast-clubs,"Braintree Armed Forces & Veterans Breakfast Clubs",,,,,,,,,,,,,,,,,,,,,,"The Pub                         East Street                    Braintree                    Essex                    CM7 3JJ                    United Kingdom",,,"CM7 3JJ","United Kingdom",,,Braintree,,,,
https://www.afvbc.com/afvbc-uk-breakfast-clubs,"Bramford Armed Forces & Veterans Breakfast Clubs",,,,,,,,,,,,,,,,,,,,,,"Bramford and District Social Club                         71-73 The Street                    Bramford                    Ipswich                    IP8 4DX                    United Kingdom",,,"IP8 4DX","United Kingdom",,,"Mid Suffolk",,,,
https://www.afvbc.com/afvbc-uk-breakfast-clubs,"Bridgewater Armed Forces & Veterans Breakfast Clubs",,,,,,,,,,,,,,,,,,,,,,"The Royal British Legion Club                         29 Old Main Road                    Pawlett                    Bridgwater                    TA6 4RY                    United Kingdom",,,"TA6 4RY","United Kingdom",,,Somerset,,,,
https://www.afvbc.com/afvbc-uk-breakfast-clubs,"Bridlington Armed Forces & Veterans Breakfast Clubs",,,,,,,,,,,,,,,,,,,,,,"Richies Cafe Bar                         Princess Mary Promenade                    Bridlington                    YO15 3LG                    United Kingdom",,,"YO15 3LG","United Kingdom",,,"East Riding of Yorkshire",,,,
https://www.afvbc.com/afvbc-uk-breakfast-clubs,"Brighton & Worthing Armed Forces & Veterans Breakfast Clubs",,,,,,,,,,,,,,,,,,,,,,"Toby Carvery Downlands                         Upper Worthing Road                    Worthing                    West Sussex                    BN14 9JN                    United Kingdom",,,"BN14 9JN","United Kingdom",,,Worthing,,,,
https://www.afvbc.com/afvbc-uk-breakfast-clubs,"Bristol Armed Forces & Veterans Breakfast Clubs",,,,,,,,,,,,,,,,,,,,,,"The Jolly Cobbler                         Chiphouse Road                    Kingswood                    Bristol                    BS15 4TR                    United Kingdom",,,"BS15 4TR","United Kingdom",,,"South Gloucestershire",,,,
https://www.afvbc.com/afvbc-uk-breakfast-clubs,"Bristol (North) Armed Forces & Veterans Breakfast Clubs",,,,,,,,,,,,,,,,,,,,,,"The Henbury Arms                         189 Henbury Road                    Henbury                    Bristol                    BS10 7AD                    United Kingdom",,,"BS10 7AD","United Kingdom",,,"Bristol, City of",,,,
https://www.afvbc.com/afvbc-uk-breakfast-clubs,"Broughton Astley Armed Forces & Veterans Breakfast Clubs",,,,,,,,,,,,,,,,,,,,,,"The Red Admiral                         163 Station Road                    Broughton Astley                    LE9 6PU                    United Kingdom",,,"LE9 6PU","United Kingdom",,,Harborough,,,,
https://www.afvbc.com/afvbc-uk-breakfast-clubs,"Buckley Armed Forces & Veterans Breakfast Clubs",,,,,,,,,,,,,,,,,,,,,,"Refurbs Cafe                         9 Brunswick Road                    Buckley                    CH7 2ED                    United Kingdom",,,"CH7 2ED","United Kingdom",,,Flintshire,,,,
https://www.afvbc.com/afvbc-uk-breakfast-clubs,"Bude Armed Forces & Veterans Breakfast Clubs",,,,,,,,,,,,,,,,,,,,,,"Morwenna Cafe                         Morwenna Terrace                    Bude                    EX23 8BU                    United Kingdom",,,"EX23 8BU","United Kingdom",,,Cornwall,,,,
https://www.afvbc.com/afvbc-uk-breakfast-clubs,"Bulkington Armed Forces & Veterans Breakfast Clubs",,,,,,,,,,,,,,,,,,,,,,"The White Lion Public House                         Leicester Street                    Bulkington                    CV12 9NG                    United Kingdom",,,"CV12 9NG","United Kingdom",,,"Nuneaton and Bedworth",,,,
https://www.afvbc.com/afvbc-uk-breakfast-clubs,"Buntingford Armed Forces & Veterans Breakfast Clubs",,,,,,,,,,,,,,,,,,,,,,"Fox & Duck Public House                         23 Church Street                    Buntingford                     SG9 9AS                     United Kingdom",,,"SG9 9AS","United Kingdom",,,"East Hertfordshire",,,,
https://www.afvbc.com/afvbc-uk-breakfast-clubs,"Burnley Armed Forces & Veterans Breakfast Clubs",,,,,,,,,,,,,,,,,,,,,,"The Boot Inn                         18 St James&#039;s Lane                    Burnley                    BB11 1NG                    United Kingdom",,,"BB11 1NG","United Kingdom",,,Burnley,,,,
https://www.afvbc.com/afvbc-uk-breakfast-clubs,"Burton-on-Trent Armed Forces & Veterans Breakfast Clubs",,,,,,,,,,,,,,,,,,,,,,"Langan&#039;s Tea Rooms                         Burton House                    George Street                    Burton upon Trent, Staffordshire                    DE14 1DP                    United Kingdom",,,"DE14 1DP","United Kingdom",,,"East Staffordshire",,,,
https://www.afvbc.com/afvbc-uk-breakfast-clubs,"Bury Armed Forces & Veterans Breakfast Clubs",,,,,,,,,,,,,,,,,,,,,,"The Sundial                         312 Walmersley Road                    Bury                    BL9 6QF                    United Kingdom",,,"BL9 6QF","United Kingdom",,,Bury,,,,
https://www.afvbc.com/afvbc-uk-breakfast-clubs,"Bury St Edmunds Armed Forces & Veterans Breakfast Clubs",,,,,,,,,,,,,,,,,,,,,,"Dragonfly Hotel                         Symonds Rd                    Bury St Edmunds                    IP32 7DZ                    United Kingdom",,,"IP32 7DZ","United Kingdom",,,"West Suffolk",,,,
https://www.afvbc.com/afvbc-uk-breakfast-clubs,"Caernarfon Armed Forces & Veterans Breakfast Clubs",,,,,,,,,,,,,,,,,,,,,,"Tafarn Y Porth (Wetherspoon)                          5-9 Greengate St                    Caernarfon                    LL55 1AG                    United Kingdom",,,"LL55 1AG","United Kingdom",,,Gwynedd,,,,
https://www.afvbc.com/afvbc-uk-breakfast-clubs,"Caithness Armed Forces & Veterans Breakfast Clubs",,,,,,,,,,,,,,,,,,,,,,"The Old Smiddy Pub                         Stewart Crescent                    Thrumster                    Caithness                    KW1 5TS                    United Kingdom",,,"KW1 5TS","United Kingdom",,,Highland,,,,
https://www.afvbc.com/afvbc-uk-breakfast-clubs,"Callander Armed Forces & Veterans Breakfast Clubs",,,,,,,,,,,,,,,,,,,,,,"Dreadnought Hotel                          Leny Road                    Callander                    Stirlingshire                    FK17 8AN                    United Kingdom",,,"FK17 8AN","United Kingdom",,,Stirling,,,,
https://www.afvbc.com/afvbc-uk-breakfast-clubs,"Calne Armed Forces & Veterans Breakfast Clubs",,,,,,,,,,,,,,,,,,,,,,"The Bug & Spider                         221 Oxford Street                    Calne                    Wiltshire                    SN11 8AW                    United Kingdom",,,"SN11 8AW","United Kingdom",,,Wiltshire,,,,
https://www.afvbc.com/afvbc-uk-breakfast-clubs,"Cambridge Armed Forces & Veterans Breakfast Clubs",,,,,,,,,,,,,,,,,,,,,,"Brown&#039;s Field Youth & Community Centre                         31a Green End Road                    Cambridge                    CB4 2UR                    United Kingdom",,,"CB4 2UR","United Kingdom",,,Cambridge,,,,
https://www.afvbc.com/afvbc-uk-breakfast-clubs,"Canterbury Armed Forces & Veterans Breakfast Clubs",,,,,,,,,,,,,,,,,,,,,,"Cafe Solo                         302 Wincheap                    Canterbury                    Kent                    CT1 3TY                    United Kingdom",,,"CT1 3TY","United Kingdom",,,Canterbury,,,,
https://www.afvbc.com/afvbc-uk-breakfast-clubs,"Cardigan (Wales) Armed Forces & Veterans Breakfast Clubs",,,,,,,,,,,,,,,,,,,,,,"Castle Cafe & Cellar Bar                         Quay Street                    Cardigan                    Ceredigion, Wales                    SA43 1HU                    United Kingdom",,,"SA43 1HU","United Kingdom",,,Ceredigion,,,,
https://www.afvbc.com/afvbc-uk-breakfast-clubs,"Carrickfergus Armed Forces & Veterans Breakfast Clubs",,,,,,,,,,,,,,,,,,,,,,"FOR ADDRESS DETAILS                         VISIT FACEBOOK                     ADDRESS SHOWN ON MAP                    IS NOT CLUB MEETING POINT.",,,,"United Kingdom",,,,,,,
https://www.afvbc.com/afvbc-uk-breakfast-clubs,"Castleford Armed Forces & Veterans Breakfast Clubs",,,,,,,,,,,,,,,,,,,,,,"The Glass Blower (Weatherspoon)                         15 Bank Street                    Castleford                    WF10 1JD                    United Kingdom",,,"WF10 1JD","United Kingdom",,,Wakefield,,,,
