https://www.afvbc.com/afvbc-uk-breakfast-clubs,"Largs Armed Forces & Veterans Breakfast Clubs",,,,,,,,,,,,,,,,,,,,,,"Indigo Eats                          68 Gallowgate Street                    Largs                    KA30 8LZ                    United Kingdom",,,"KA30 8LZ","United Kingdom",,,"North Ayrshire",,,,
https://www.afvbc.com/afvbc-uk-breakfast-clubs,"Larne Armed Forces & Veterans Breakfast Clubs",,,,,,,,,,,,,,,,,,,,,,"DETAILS SHOWN ON MAP                         IS NOT MEETING LOCATION                    VISIT FACEBOOK FOR                     MORE DETAILS                    NAAFI CAFE. (Home Of The First Familes4veterans Breakfast Club)",,,,"United Kingdom",,,,,,,
https://www.afvbc.com/afvbc-uk-breakfast-clubs,"Launceston Armed Forces & Veterans Breakfast Clubs",,,,,,,,,,,,,,,,,,,,,,"Launceston British Legion                         Westgate Street                    Launceston                    PL15 7AE                    United Kingdom",,,"PL15 7AE","United Kingdom",,,Cornwall,,,,
https://www.afvbc.com/afvbc-uk-breakfast-clubs,"Leeds (North) Armed Forces & Veterans Breakfast Clubs",,,,,,,,,,,,,,,,,,,,,,"Travellers Rest                         49 Hill Top Road                    Armley                    Leeds                    LS123PY                    United Kingdom",,,LS123PY,"United Kingdom",,,Leeds,,,,
https://www.afvbc.com/afvbc-uk-breakfast-clubs,"Leicester (Central) Armed Forces & Veterans Breakfast Clubs",,,,,,,,,,,,,,,,,,,,,,"The Last Plantagenet                         107 Granby Street                    Leicester                    Leicestershire                    LE1 6FD                    United Kingdom",,,"LE1 6FD","United Kingdom",,,Leicester,,,,
https://www.afvbc.com/afvbc-uk-breakfast-clubs,"Leigh Armed Forces & Veterans Breakfast Clubs",,,,,,,,,,,,,,,,,,,,,,"The Thomas Burke                         Leigh                    Greater Manchester                    WN7 1QR                    United Kingdom",,,"WN7 1QR","United Kingdom",,,Wigan,,,,
https://www.afvbc.com/afvbc-uk-breakfast-clubs,"Leominster Armed Forces & Veterans Breakfast Clubs",,,,,,,,,,,,,,,,,,,,,,"The Dukes Head                         3 Corn Square                    Leominster                    Herefordshire                    HR6 8LR                    United Kingdom",,,"HR6 8LR","United Kingdom",,,"Herefordshire, County of",,,,
https://www.afvbc.com/afvbc-uk-breakfast-clubs,"Leyland Armed Forces & Veterans Breakfast Clubs",,,,,,,,,,,,,,,,,,,,,,"St Ambrose Church Halls                         44 Moss Lane                    Leyland                    PR25 4SH                    United Kingdom",,,"PR25 4SH","United Kingdom",,,"South Ribble",,,,
https://www.afvbc.com/afvbc-uk-breakfast-clubs,"Lichfield & Rugeley Armed Forces & Veterans Breakfast Clubs",,,,,,,,,,,,,,,,,,,,,,"The Kings Head                         21 Bird Street                    Lichfield                    Staffs                     WS13 6PW                    United Kingdom",,,"WS13 6PW","United Kingdom",,,Lichfield,,,,
https://www.afvbc.com/afvbc-uk-breakfast-clubs,"Limassol & WSBA Armed Forces & Veterans Breakfast Clubs",,,,,,,,,,,,,,,,,,,,,,"British Food Vendor                         Market Mall (at rear)                    Ypsonis                    Limassol 4630                    Cyprus",,,,"United Kingdom",,,,,,,
https://www.afvbc.com/afvbc-uk-breakfast-clubs,"Lincoln Armed Forces & Veterans Breakfast Clubs",,,,,,,,,,,,,,,,,,,,,,"Lake View Restaurant                         Moor Lane                    Thorpe on the Hill                    LN6 9BW                    United Kingdom",,,"LN6 9BW","United Kingdom",,,"North Kesteven",,,,
https://www.afvbc.com/afvbc-uk-breakfast-clubs,"Liskeard Armed Forces & Veterans Breakfast Clubs",,,,,,,,,,,,,,,,,,,,,,"The Market Cafe                         Liskeard                    Cornwall                    North Yorkshire                    PL14 4AA                    United Kingdom",,,"PL14 4AA","United Kingdom",,,Cornwall,,,,
https://www.afvbc.com/afvbc-uk-breakfast-clubs,"Littlehampton Armed Forces & Veterans Breakfast Clubs",,,,,,,,,,,,,,,,,,,,,,"The Old Corn Store Bar & Bistro                         72 High Street                    Littlehampton                    West Sussex                    BN17 5DX                    United Kingdom",,,"BN17 5DX","United Kingdom",,,Arun,,,,
https://www.afvbc.com/afvbc-uk-breakfast-clubs,"Liverpool (Merseyside) Armed Forces & Veterans Breakfast Clubs",,,,,,,,,,,,,,,,,,,,,,"Cornmarket Pub                         Old Ropery                    Liverpool                    L2 7NT                    United Kingdom",,,"L2 7NT","United Kingdom",,,Liverpool,,,,
https://www.afvbc.com/afvbc-uk-breakfast-clubs,"Livingston (North) Armed Forces & Veterans Breakfast Clubs",,,,,,,,,,,,,,,,,,,,,,"Chain Runner                         Almondvale Way                    Livingston                    West Lothian                    EH54 6GA                    United Kingdom",,,"EH54 6GA","United Kingdom",,,"West Lothian",,,,
https://www.afvbc.com/afvbc-uk-breakfast-clubs,"Llanfairfechan Armed Forces & Veterans Breakfast Clubs",,,,,,,,,,,,,,,,,,,,,,"Beach Pavilion Cafe                         Promenade                    Llanfairfechan                    LL33 0BY                    United Kingdom",,,"LL33 0BY","United Kingdom",,,Conwy,,,,
https://www.afvbc.com/afvbc-uk-breakfast-clubs,"Llangrove Armed Forces & Veterans Breakfast Clubs",,,,,,,,,,,,,,,,,,,,,,"The Royal Arms                         Llangrove                    Ross-on-Wye                    Herefordshire                    HR9 6EZ                    United Kingdom",,,"HR9 6EZ","United Kingdom",,,"Herefordshire, County of",,,,
https://www.afvbc.com/afvbc-uk-breakfast-clubs,"Lochgilphead Armed Forces & Veterans Breakfast Clubs",,,,,,,,,,,,,,,,,,,,,,"The Rumbling Tum Cafe                         87 Chalmers Street                    Ardrishaig                    PA30 8DX                    United Kingdom",,,"PA30 8DX","United Kingdom",,,"Argyll and Bute",,,,
https://www.afvbc.com/afvbc-uk-breakfast-clubs,"Long Eaton Armed Forces & Veterans Breakfast Clubs",,,,,,,,,,,,,,,,,,,,,,"The Stumble Inn                         37 Tamworth Road                    Long Eaton                    Nottinghamshire                    NG10 1JF                    United Kingdom",,,"NG10 1JF","United Kingdom",,,Erewash,,,,
https://www.afvbc.com/afvbc-uk-breakfast-clubs,"Lowestoft Armed Forces & Veterans Breakfast Clubs",,,,,,,,,,,,,,,,,,,,,,"Lord Kitcheners Guest House                         10 Kirkley Cliff                    Lowestoft                    NR32 5HF                    United Kingdom",,,"NR32 5HF","United Kingdom",,,"East Suffolk",,,,
https://www.afvbc.com/afvbc-uk-breakfast-clubs,"Ludlow Armed Forces & Veterans Breakfast Clubs",,,,,,,,,,,,,,,,,,,,,,"Bakers of Tower Street                         Tower Street                    Ludlow                     SY8 1RL                    United Kingdom",,,"SY8 1RL","United Kingdom",,,Shropshire,,,,
https://www.afvbc.com/afvbc-uk-breakfast-clubs,"Luton & District Armed Forces & Veterans Breakfast Clubs",,,,,,,,,,,,,,,,,,,,,,"The Chequers                         East End                    Houghton Regis                    Dunstable                    LU5 4JN                    United Kingdom",,,"LU5 4JN","United Kingdom",,,"Central Bedfordshire",,,,
https://www.afvbc.com/afvbc-uk-breakfast-clubs,"Lutterworth Armed Forces & Veterans Breakfast Clubs",,,,,,,,,,,,,,,,,,,,,,"Wycliffe Rooms                         George St                    Lutterworth                    LE17 4ED                    United Kingdom",,,"LE17 4ED","United Kingdom",,,Harborough,,,,
https://www.afvbc.com/afvbc-uk-breakfast-clubs,"Lymington Armed Forces & Veterans Breakfast Clubs",,,,,,,,,,,,,,,,,,,,,,"The Royal British Legion Club                         Haig House                    22a High Street                    Lymington                    SO41 9AD                    United Kingdom",,,"SO41 9AD","United Kingdom",,,"New Forest",,,,
https://www.afvbc.com/afvbc-uk-breakfast-clubs,"Macclesfield Armed Forces & Veterans Breakfast Clubs",,,,,,,,,,,,,,,,,,,,,,"Macclesfield Masonic Hall                         1 Riseley Street                    Macclesfield                    SK10 1BW                    United Kingdom",,,"SK10 1BW","United Kingdom",,,"Cheshire East",,,,
https://www.afvbc.com/afvbc-uk-breakfast-clubs,"Maldon Armed Forces & Veterans Breakfast Clubs",,,,,,,,,,,,,,,,,,,,,,"The Jolly Sailor                         Basin Road                    Heybridge Basin                    Essex                    CM9 4RS                    United Kingdom",,,"CM9 4RS","United Kingdom",,,Maldon,,,,
https://www.afvbc.com/afvbc-uk-breakfast-clubs,"Malvern Hills Armed Forces & Veterans Breakfast Clubs",,,,,,,,,,,,,,,,,,,,,,"The Foley Arms Hotel                         14 Worcester Rd                    Malvern                    WR14 4QS                    United Kingdom",,,"WR14 4QS","United Kingdom",,,"Malvern Hills",,,,
https://www.afvbc.com/afvbc-uk-breakfast-clubs,"Manchester Newton Heath Armed Forces & Veterans Breakfast Clubs",,,,,,,,,,,,,,,,,,,,,,"Stirling Community Centre                         Scotland Hall Road                    Newton Heath                    Manchester                    M40 2AZ                    United Kingdom",,,"M40 2AZ","United Kingdom",,,Manchester,,,,
https://www.afvbc.com/afvbc-uk-breakfast-clubs,"Mansfield & Ashfield Armed Forces & Veterans Breakfast Clubs",,,,,,,,,,,,,,,,,,,,,,"The Bold Forester                         Botany Avenue                    Mansfield                    NG18 5NG                    United Kingdom",,,"NG18 5NG","United Kingdom",,,Mansfield,,,,
https://www.afvbc.com/afvbc-uk-breakfast-clubs,"March Armed Forces & Veterans Breakfast Clubs",,,,,,,,,,,,,,,,,,,,,,"Cassanos                         78-82 High Street                    March                    Cambridgeshire                    PE15 9LD                    United Kingdom",,,"PE15 9LD","United Kingdom",,,Fenland,,,,
https://www.afvbc.com/afvbc-uk-breakfast-clubs,"Market Deeping Armed Forces & Veterans Breakfast Clubs",,,,,,,,,,,,,,,,,,,,,,"Iron Horse Ranch House                         2 High Street                    Market Deeping                    Lincolnshire                    PE6 8EB                    United Kingdom",,,"PE6 8EB","United Kingdom",,,"South Kesteven",,,,
https://www.afvbc.com/afvbc-uk-breakfast-clubs,"Market Harborough Armed Forces & Veterans Breakfast Clubs",,,,,,,,,,,,,,,,,,,,,,"The Royalist                         29 Western Avenue                    Market Harborough                    LE16 9PL                    United Kingdom",,,"LE16 9PL","United Kingdom",,,Harborough,,,,
https://www.afvbc.com/afvbc-uk-breakfast-clubs,"Market Rasen Armed Forces & Veterans Breakfast Clubs",,,,,,,,,,,,,,,,,,,,,,"The Advocate Arms                         2 Queen Street                    Market Rasen                    LN8 3EH                    United Kingdom",,,"LN8 3EH","United Kingdom",,,"West Lindsey",,,,
https://www.afvbc.com/afvbc-uk-breakfast-clubs,"Market Weighton Armed Forces & Veterans Breakfast Clubs",,,,,,,,,,,,,,,,,,,,,,"The Acorns Community Hub                         76 Market Place                    Market Weighton                    YO43 3AW                    United Kingdom",,,"YO43 3AW","United Kingdom",,,"East Riding of Yorkshire",,,,
https://www.afvbc.com/afvbc-uk-breakfast-clubs,"Marlborough & District Armed Forces & Veterans Breakfast Clubs",,,,,,,,,,,,,,,,,,,,,,"The White Harte                         116 High Street                    Marlborough                    SN8 1LZ                    United Kingdom",,,"SN8 1LZ","United Kingdom",,,Wiltshire,,,,
https://www.afvbc.com/afvbc-uk-breakfast-clubs,"Melbourn Armed Forces & Veterans Breakfast Clubs",,,,,,,,,,,,,,,,,,,,,,"The Dolphin                         105 High Street                    Melbourn                    Royston                     SG8 6AP                    United Kingdom",,,"SG8 6AP","United Kingdom",,,"South Cambridgeshire",,,,
https://www.afvbc.com/afvbc-uk-breakfast-clubs,"Melksham Armed Forces & Veterans Breakfast Clubs",,,,,,,,,,,,,,,,,,,,,,"The Forester Arms                         87 Sandridge Road                    Melksham                    SN12 7BN                     United Kingdom",,,"SN12 7BN","United Kingdom",,,Wiltshire,,,,
https://www.afvbc.com/afvbc-uk-breakfast-clubs,"Melton Mowbray Armed Forces & Veterans Breakfast Clubs",,,,,,,,,,,,,,,,,,,,,,"The Harboro Hotel                         49-51 Burton Street                    Melton Mowbray                    LE13 1AF                    United Kingdom",,,"LE13 1AF","United Kingdom",,,Melton,,,,
https://www.afvbc.com/afvbc-uk-breakfast-clubs,"Merstham (East Surry) Armed Forces & Veterans Breakfast Clubs",,,,,,,,,,,,,,,,,,,,,,"The Café                         4 Portland Drive                    Merstham                    Surrey                    RH1 3HY                    United Kingdom",,,"RH1 3HY","United Kingdom",,,"Reigate and Banstead",,,,
https://www.afvbc.com/afvbc-uk-breakfast-clubs,"Merthyr Tydfil Armed Forces & Veterans Breakfast Clubs",,,,,,,,,,,,,,,,,,,,,,"Redhouse Cymru                         Old Town Hall                    High Street                    Merthyr Tydfil                    CF47 8AE                    United Kingdom",,,"CF47 8AE","United Kingdom",,,"Merthyr Tydfil",,,,
https://www.afvbc.com/afvbc-uk-breakfast-clubs,"Middlesbrough Armed Forces & Veterans Breakfast Clubs",,,,,,,,,,,,,,,,,,,,,,"Connections Community Cafe                         131-133 Linthorpe Road                    Middlesbrough                    TS1 5DE                    United Kingdom",,,"TS1 5DE","United Kingdom",,,Middlesbrough,,,,
https://www.afvbc.com/afvbc-uk-breakfast-clubs,"Middlewich Armed Forces & Veterans Breakfast Clubs",,,,,,,,,,,,,,,,,,,,,,"The Turnpike                         78 Warmingham Lane                    Middlewich                    CW10 0DJ                    United Kingdom",,,"CW10 0DJ","United Kingdom",,,"Cheshire East",,,,
https://www.afvbc.com/afvbc-uk-breakfast-clubs,"Midhurst Armed Forces & Veterans Breakfast Clubs",,,,,,,,,,,,,,,,,,,,,,"The Wheatsheaf                         Wool Lane                    Midhurst                    West Sussex                    GU29 9BX                    United Kingdom",,,"GU29 9BX","United Kingdom",,,Chichester,,,,
https://www.afvbc.com/afvbc-uk-breakfast-clubs,"Midlothian Armed Forces & Veterans Breakfast Clubs",,,,,,,,,,,,,,,,,,,,,,"Elginhaugh Farm                         Farmhouse Inns                    9 Gilmerton Road                    Lasswade, Midlothian                    EH18 1AZ                    United Kingdom",,,"EH18 1AZ","United Kingdom",,,Midlothian,,,,
https://www.afvbc.com/afvbc-uk-breakfast-clubs,"Mildenhall Armed Forces & Veterans Breakfast Clubs",,,,,,,,,,,,,,,,,,,,,,"RAF Mildenhall                         Bury St Edmunds                    Suffolk                    IP28 8NF                    United Kingdom",,,"IP28 8NF","United Kingdom",,,"West Suffolk",,,,
https://www.afvbc.com/afvbc-uk-breakfast-clubs,"Milford Haven Armed Forces & Veterans Breakfast Clubs",,,,,,,,,,,,,,,,,,,,,,"Bus Stop Cafe                         Hamilton Terrace                    Milford Haven                    SA73 3LE                    United Kingdom",,,"SA73 3LE","United Kingdom",,,Pembrokeshire,,,,
https://www.afvbc.com/afvbc-uk-breakfast-clubs,"Milton Keynes Armed Forces & Veterans Breakfast Clubs",,,,,,,,,,,,,,,,,,,,,,"Captain Ridley’s Shooting Party                         183-185 Queensway                    Fenny Stratford, Bletchley                    Milton Keynes                    MK2 2ED                    United Kingdom",,,"MK2 2ED","United Kingdom",,,"Milton Keynes",,,,
https://www.afvbc.com/afvbc-uk-breakfast-clubs,"Minehead Armed Forces & Veterans Breakfast Clubs",,,,,,,,,,,,,,,,,,,,,,"Duke of Wellington                         Wellington Square                    Minehead                    TA24 5NH                    United Kingdom",,,"TA24 5NH","United Kingdom",,,Somerset,,,,
https://www.afvbc.com/afvbc-uk-breakfast-clubs,"Mobberley & Knutsford Armed Forces & Veterans Breakfast Clubs",,,,,,,,,,,,,,,,,,,,,,"The Legh Arms                         Brook Street                    Knutsford                    WA16 8EB                    United Kingdom",,,"WA16 8EB","United Kingdom",,,"Cheshire East",,,,
https://www.afvbc.com/afvbc-uk-breakfast-clubs,"Moray Armed Forces & Veterans Breakfast Clubs",,,,,,,,,,,,,,,,,,,,,,"Red Lion (Beastie Bar)                         2-6 Tolbooth St                    Forres                    IV36 1PH                    United Kingdom",,,"IV36 1PH","United Kingdom",,,Moray,,,,
https://www.afvbc.com/afvbc-uk-breakfast-clubs,"Musselburgh (East Lothian) Armed Forces & Veterans Breakfast Clubs",,,,,,,,,,,,,,,,,,,,,,"The Royal British Legion                         19 Rope Walk                    Prestonpans                    East Lothian                    EH32 9BN                    United Kingdom",,,"EH32 9BN","United Kingdom",,,"East Lothian",,,,
https://www.afvbc.com/afvbc-uk-breakfast-clubs,"Nantwich Armed Forces & Veterans Breakfast Clubs",,,,,,,,,,,,,,,,,,,,,,"The Market Tearoom                         Nantwich Market Hall                    Market Street                    Nantwich, Cheshire                     CW5 5DG                    United Kingdom",,,"CW5 5DG","United Kingdom",,,"Cheshire East",,,,
https://www.afvbc.com/afvbc-uk-breakfast-clubs,"New Mills Armed Forces & Veterans Breakfast Clubs",,,,,,,,,,,,,,,,,,,,,,"The Pride of the Peaks                         59 Market Street                    New Mills                    High Peak                    SK22 4AA                    United Kingdom",,,"SK22 4AA","United Kingdom",,,"High Peak",,,,
https://www.afvbc.com/afvbc-uk-breakfast-clubs,"Newark Armed Forces & Veterans Breakfast Clubs",,,,,,,,,,,,,,,,,,,,,,"Newark Town Bowls Club                         London Road                    Newark-on-Trent                    Newark                     NG24 1TS                    United Kingdom",,,"NG24 1TS","United Kingdom",,,"Newark and Sherwood",,,,
https://www.afvbc.com/afvbc-uk-breakfast-clubs,"Newbury Thatcham Armed Forces & Veterans Breakfast Clubs",,,,,,,,,,,,,,,,,,,,,,"Thatcham Rugby Union Football Club                         Henwick Worthy Sports Fields                    Henwick Lane                    Thatcham                    RG18 3BN                    United Kingdom",,,"RG18 3BN","United Kingdom",,,"West Berkshire",,,,
https://www.afvbc.com/afvbc-uk-breakfast-clubs,"Newcastle Armed Forces & Veterans Breakfast Clubs",,,,,,,,,,,,,,,,,,,,,,"The Corner House                         317 Heaton Road                    Newcastle upon Tyne                    NE6 5QD                    United Kingdom",,,"NE6 5QD","United Kingdom",,,"Newcastle upon Tyne",,,,
https://www.afvbc.com/afvbc-uk-breakfast-clubs,"Newent Armed Forces & Veterans Breakfast Clubs",,,,,,,,,,,,,,,,,,,,,,"Erol&#039;s Courtyard Cafe                         Shambles Village                    16-18 Church Street                    Newent, Gloucester                    GL18 1PP                    United Kingdom",,,"GL18 1PP","United Kingdom",,,"Forest of Dean",,,,
https://www.afvbc.com/afvbc-uk-breakfast-clubs,"Newport (Shropshire) Armed Forces & Veterans Breakfast Clubs",,,,,,,,,,,,,,,,,,,,,,"Royal Naval Association Club                         Bellmans Yard                    Newport                    Shropshire                    TF10 7AJ                    United Kingdom",,,"TF10 7AJ","United Kingdom",,,"Telford and Wrekin",,,,
https://www.afvbc.com/afvbc-uk-breakfast-clubs,"Newport (South Wales) Armed Forces & Veterans Breakfast Clubs",,,,,,,,,,,,,,,,,,,,,,"The Potters Pub                         22-24 Upper Dock Street                    Newport                    South Wales                    NP20 1DL                    United Kingdom",,,"NP20 1DL","United Kingdom",,,Newport,,,,
https://www.afvbc.com/afvbc-uk-breakfast-clubs,"Newquay Armed Forces & Veterans Breakfast Clubs",,,,,,,,,,,,,,,,,,,,,,"Great Western Hotel                         Cliff Road                    Narrowcliff                    Newquay                    TR7 2NE                    United Kingdom",,,"TR7 2NE","United Kingdom",,,Cornwall,,,,
https://www.afvbc.com/afvbc-uk-breakfast-clubs,"Newton Abbot Armed Forces & Veterans Breakfast Clubs",,,,,,,,,,,,,,,,,,,,,,"The Royal British Legion                         2 Marsh Road                    Newton Abbot                    TQ12 2AP                    United Kingdom",,,"TQ12 2AP","United Kingdom",,,Teignbridge,,,,
https://www.afvbc.com/afvbc-uk-breakfast-clubs,"Newton Stewart Armed Forces & Veterans Breakfast Clubs",,,,,,,,,,,,,,,,,,,,,,"Creebridge House Hotel                         6 Creebridge                    Newton Stewart                    DG8 6NP                    United Kingdom",,,"DG8 6NP","United Kingdom",,,"Dumfries and Galloway",,,,
https://www.afvbc.com/afvbc-uk-breakfast-clubs,"Newtownabbey Armed Forces & Veterans Breakfast Clubs",,,,,,,,,,,,,,,,,,,,,,"Ulster Transport Bowling Club                         Lynda Avenue                    Jordanstown                    County Antrim                    BT37 0NX                    United Kingdom",,,"BT37 0NX","United Kingdom",,,"Antrim and Newtownabbey",,,,
https://www.afvbc.com/afvbc-uk-breakfast-clubs,"North Tawton Armed Forces & Veterans Breakfast Clubs",,,,,,,,,,,,,,,,,,,,,,"Jen&#039;s Cafe                         9 The Square                    North Tawton                    EX20 2EP                    United Kingdom",,,"EX20 2EP","United Kingdom",,,"West Devon",,,,
https://www.afvbc.com/afvbc-uk-breakfast-clubs,"Northallerton Armed Forces & Veterans Breakfast Clubs",,,,,,,,,,,,,,,,,,,,,,"The Buck Inn                         237-238 High Street                    Northallerton                     DL7 8LU                    United Kingdom",,,"DL7 8LU","United Kingdom",,,"North Yorkshire",,,,
https://www.afvbc.com/afvbc-uk-breakfast-clubs,"Northampton & Duston Armed Forces & Veterans Breakfast Clubs",,,,,,,,,,,,,,,,,,,,,,"Poppyfields Pub                         Telstar Way                    Duston                    NN5 6GT                    United Kingdom",,,"NN5 6GT","United Kingdom",,,"West Northamptonshire",,,,
https://www.afvbc.com/afvbc-uk-breakfast-clubs,"Northwich Armed Forces & Veterans Breakfast Clubs",,,,,,,,,,,,,,,,,,,,,,"The Royal British Legion                         Firth Fields                    Davenham                    Northwich, Cheshire                    CW9 8JB                    United Kingdom",,,"CW9 8JB","United Kingdom",,,"Cheshire West and Chester",,,,
https://www.afvbc.com/afvbc-uk-breakfast-clubs,"Norton Radstock Armed Forces & Veterans Breakfast Clubs",,,,,,,,,,,,,,,,,,,,,,"The Palladium Electric                         110 High Street                    Midsomer Norton                    Radstock                    BA3 2DA                    United Kingdom",,,"BA3 2DA","United Kingdom",,,"Bath and North East Somerset",,,,
https://www.afvbc.com/afvbc-uk-breakfast-clubs,"Norwich Armed Forces & Veterans Breakfast Clubs",,,,,,,,,,,,,,,,,,,,,,"The Village Inn                         33-43 School Lane                    Little Melton                    Norwich                    NR9 3AD                    United Kingdom",,,"NR9 3AD","United Kingdom",,,"South Norfolk",,,,
https://www.afvbc.com/afvbc-uk-breakfast-clubs,"Nottingham Armed Forces & Veterans Breakfast Clubs",,,,,,,,,,,,,,,,,,,,,,"Via Fossa                         44 canal street                    Nottingham                    NG1 7EH                    United Kingdom",,,"NG1 7EH","United Kingdom",,,Nottingham,,,,
https://www.afvbc.com/afvbc-uk-breakfast-clubs,"Nuneaton Armed Forces & Veterans Breakfast Clubs",,,,,,,,,,,,,,,,,,,,,,"Middlemarch Farm                         St Davids Way                    Bermuda Park                    Nuneaton                    CV10 7NS                    United Kingdom",,,"CV10 7NS","United Kingdom",,,"Nuneaton and Bedworth",,,,
https://www.afvbc.com/afvbc-uk-breakfast-clubs,"Okehampton Armed Forces & Veterans Breakfast Clubs",,,,,,,,,,,,,,,,,,,,,,"The London Inn                         22 West Street                    Okehampton                    EX20 1HH                    United Kingdom",,,"EX20 1HH","United Kingdom",,,"West Devon",,,,
https://www.afvbc.com/afvbc-uk-breakfast-clubs,"Oldbury Armed Forces & Veterans Breakfast Clubs",,,,,,,,,,,,,,,,,,,,,,"Court of Request                         Church Street                    Oldbury                    B69 3AF                    United Kingdom",,,"B69 3AF","United Kingdom",,,Sandwell,,,,
https://www.afvbc.com/afvbc-uk-breakfast-clubs,"Oldham Armed Forces & Veterans Breakfast Clubs",,,,,,,,,,,,,,,,,,,,,,"The Hunt Lane Tavern                         754 Middleton Road                    Chadderton                    Oldham                    OL9 0LD                    United Kingdom",,,"OL9 0LD","United Kingdom",,,Oldham,,,,
https://www.afvbc.com/afvbc-uk-breakfast-clubs,"Orkney Armed Forces & Veterans Breakfast Clubs",,,,,,,,,,,,,,,,,,,,,,"Various  in Orkney                         Visit Facebook Group                    For more information",,,,"United Kingdom",,,,,,,
https://www.afvbc.com/afvbc-uk-breakfast-clubs,"Ormskirk Armed Forces & Veterans Breakfast Clubs",,,,,,,,,,,,,,,,,,,,,,"Toby Carvery Ormskirk                         County Road                    Ormskirk                    Lancashire                    LN39 1NN                    United Kingdom",,,"LN39 1NN","United Kingdom",,,,,,,
