https://www.afvbc.com/afvbc-uk-breakfast-clubs,"Falkirk Armed Forces & Veterans Breakfast Clubs",,,,,,,,,,,,,,,,,,,,,,"The Graeme Hotel                         40 Grahams Rd                    Falkirk                    FK1 1HR                    United Kingdom",,,"FK1 1HR","United Kingdom",,,Falkirk,,,,
https://www.afvbc.com/afvbc-uk-breakfast-clubs,"Faversham Armed Forces & Veterans Breakfast Clubs",,,,,,,,,,,,,,,,,,,,,,"The Courtyard Restaurant                         Brogdale Farm                     Brogdale Road                    Faversham, Kent                    ME13 8XZ                    United Kingdom",,,"ME13 8XZ","United Kingdom",,,Swale,,,,
https://www.afvbc.com/afvbc-uk-breakfast-clubs,"Fife Armed Forces & Veterans Breakfast Clubs",,,,,,,,,,,,,,,,,,,,,,"Ore Bank Cafe                         Lochleven                    Lochore                    Scotland                    United Kingdom",,,,"United Kingdom",,,,,,,
https://www.afvbc.com/afvbc-uk-breakfast-clubs,"Fife (NE), Dundee & Angus Armed Forces & Veterans Breakfast Clubs",,,,,,,,,,,,,,,,,,,,,,"Ardler Community Centre                         Turnberry Avenue                    Dundee                    DD2 3TP                    United Kingdom",,,"DD2 3TP","United Kingdom",,,"Dundee City",,,,
https://www.afvbc.com/afvbc-uk-breakfast-clubs,"Fleetwood Armed Forces & Veterans Breakfast Clubs",,,,,,,,,,,,,,,,,,,,,,"The Steamer                         1-2 Queen&#039;s Terrace                    Fleetwood                     FY7 6BT                    United Kingdom",,,"FY7 6BT","United Kingdom",,,Wyre,,,,
https://www.afvbc.com/afvbc-uk-breakfast-clubs,"Flint Armed Forces & Veterans Breakfast Clubs",,,,,,,,,,,,,,,,,,,,,,"George & Dragon                         60 Church Street                    Flint                    Flintshire                    CH6 5AE                    United Kingdom",,,"CH6 5AE","United Kingdom",,,Flintshire,,,,
https://www.afvbc.com/afvbc-uk-breakfast-clubs,"Folkstone & District Armed Forces & Veterans Breakfast Clubs",,,,,,,,,,,,,,,,,,,,,,"Black Bull Pub                         Canterbury Road                    Folkestone                    Kent                     CT19 5NX                    United Kingdom",,,"CT19 5NX","United Kingdom",,,"Folkestone and Hythe",,,,
https://www.afvbc.com/afvbc-uk-breakfast-clubs,"Forfar Armed Forces & Veterans Breakfast Clubs",,,,,,,,,,,,,,,,,,,,,,"The Royal British Legion                         1 Academy Street                    Forfar                    DD8 2HA                    United Kingdom",,,"DD8 2HA","United Kingdom",,,Angus,,,,
https://www.afvbc.com/afvbc-uk-breakfast-clubs,"Foxwood (York) Armed Forces & Veterans Breakfast Clubs",,,,,,,,,,,,,,,,,,,,,,"The Dick Turpin Inn                         49 Moorcroft Road                     York                    YO24 2RQ                    United Kingdom",,,"YO24 2RQ","United Kingdom",,,York,,,,
https://www.afvbc.com/afvbc-uk-breakfast-clubs,"Fraserburgh Armed Forces & Veterans Breakfast Clubs",,,,,,,,,,,,,,,,,,,,,,"The Saltoun Inn                         Saltoun Square                    Fraserburgh                    Aberdeenshire                    AB43 9DA                    United Kingdom",,,"AB43 9DA","United Kingdom",,,Aberdeenshire,,,,
https://www.afvbc.com/afvbc-uk-breakfast-clubs,"Fulford (York) Armed Forces & Veterans Breakfast Clubs",,,,,,,,,,,,,,,,,,,,,,"The Plough Inn                         48 Main Street                    Fulford                    York                    YO10 4PX                    United Kingdom",,,"YO10 4PX","United Kingdom",,,York,,,,
https://www.afvbc.com/afvbc-uk-breakfast-clubs,"Gainsborough Armed Forces & Veterans Breakfast Clubs",,,,,,,,,,,,,,,,,,,,,,"The Venue at Roses                         North Warren Rd                    Gainsborough                    Lincs                    DN21 2TU                    United Kingdom",,,"DN21 2TU","United Kingdom",,,"West Lindsey",,,,
https://www.afvbc.com/afvbc-uk-breakfast-clubs,"Galashiels Armed Forces & Veterans Breakfast Clubs",,,,,,,,,,,,,,,,,,,,,,"Royal British Legion                         22 Park Street                    Galashiels                    TD1 1BZ                    United Kingdom",,,"TD1 1BZ","United Kingdom",,,"Scottish Borders",,,,
https://www.afvbc.com/afvbc-uk-breakfast-clubs,"Garstang Armed Forces & Veterans Breakfast Clubs",,,,,,,,,,,,,,,,,,,,,,"The Wheatsheaf                         1 Park Hill Road                    Garstang                    PR3 1EL                    United Kingdom",,,"PR3 1EL","United Kingdom",,,Wyre,,,,
https://www.afvbc.com/afvbc-uk-breakfast-clubs,"Gibraltar Armed Forces & Veterans Breakfast Clubs",,,,,,,,,,,,,,,,,,,,,,"Trafalgar Sports Bar                         1 Rosia Road                    Gibraltar                    GX11 1AA",,,"GX11 1AA","United Kingdom",,,,,,,
https://www.afvbc.com/afvbc-uk-breakfast-clubs,"Glasgow Armed Forces & Veterans Breakfast Clubs",,,,,,,,,,,,,,,,,,,,,,"Sir John Moore                         Argyll Street                    Galsgow                    G2 8QW                    United Kingdom",,,"G2 8QW","United Kingdom",,,"Glasgow City",,,,
https://www.afvbc.com/afvbc-uk-breakfast-clubs,"Glastonbury Armed Forces & Veterans Breakfast Clubs",,,,,,,,,,,,,,,,,,,,,,"Mamfs cafe                         Unit 19                    Thomas Way                    Glastonbury                    BA6 9LU                    United Kingdom",,,"BA6 9LU","United Kingdom",,,Somerset,,,,
https://www.afvbc.com/afvbc-uk-breakfast-clubs,"Gloucester Armed Forces & Veterans Breakfast Clubs",,,,,,,,,,,,,,,,,,,,,,"Brockworth (Toby Carvery)                         Shurdington Road                    Gloucester                    GL3 4PH                    United Kingdom",,,"GL3 4PH","United Kingdom",,,Tewkesbury,,,,
https://www.afvbc.com/afvbc-uk-breakfast-clubs,"Godalming Armed Forces & Veterans Breakfast Clubs",,,,,,,,,,,,,,,,,,,,,,"The Jack Phillips                         48-56 High Street                    Godalming                    GU7 1DY                    United Kingdom",,,"GU7 1DY","United Kingdom",,,Waverley,,,,
https://www.afvbc.com/afvbc-uk-breakfast-clubs,"Goole Armed Forces & Veterans Breakfast Clubs",,,,,,,,,,,,,,,,,,,,,,"City & County                         Market Square                    Goole                    DN14 5DR                    United Kingdom",,,"DN14 5DR","United Kingdom",,,"East Riding of Yorkshire",,,,
https://www.afvbc.com/afvbc-uk-breakfast-clubs,"Gosport Armed Forces & Veterans Breakfast Clubs",,,,,,,,,,,,,,,,,,,,,,"Royal Naval Association                         66 Fareham Road                    Gosport                    Hampshire                    PO13 0AG                    United Kingdom",,,"PO13 0AG","United Kingdom",,,Gosport,,,,
https://www.afvbc.com/afvbc-uk-breakfast-clubs,"Grantham Armed Forces & Veterans Breakfast Clubs",,,,,,,,,,,,,,,,,,,,,,"The Tollemache Inn                         17 St Peters Hill                    Grantham                    NG31 6PY                    United Kingdom",,,"NG31 6PY","United Kingdom",,,"South Kesteven",,,,
https://www.afvbc.com/afvbc-uk-breakfast-clubs,"Great Yarmouth Armed Forces & Veterans Breakfast Clubs",,,,,,,,,,,,,,,,,,,,,,"Cafe 63                         2 Main Cross Rd                    Great Yarmouth                    NR30 3PA                    United Kingdom",,,"NR30 3PA","United Kingdom",,,"Great Yarmouth",,,,
https://www.afvbc.com/afvbc-uk-breakfast-clubs,"Grimsby Armed Forces & Veterans Breakfast Clubs",,,,,,,,,,,,,,,,,,,,,,"The Wheatsheaf                         Bargate                    Grimsby                    DN34 5AD                    United Kingdom",,,"DN34 5AD","United Kingdom",,,"North East Lincolnshire",,,,
https://www.afvbc.com/afvbc-uk-breakfast-clubs,"Gunnislake Armed Forces & Veterans Breakfast Clubs",,,,,,,,,,,,,,,,,,,,,,"The Rising Sun Inn                         Calstock Road                    Gunnislake                    PL18 9BX                    United Kingdom",,,"PL18 9BX","United Kingdom",,,Cornwall,,,,
https://www.afvbc.com/afvbc-uk-breakfast-clubs,"Hackney Armed Forces & Veterans Breakfast Clubs",,,,,,,,,,,,,,,,,,,,,,"Baxter&#039;s Court                         282-284 Mare Street                    Hackney                    London                    E8 1HE                    United Kingdom",,,"E8 1HE","United Kingdom",,,Hackney,,,,
https://www.afvbc.com/afvbc-uk-breakfast-clubs,"Hadleigh Armed Forces & Veterans Breakfast Clubs",,,,,,,,,,,,,,,,,,,,,,"The Flying Guardsman                         66 High Street                    Hadleigh                    IP7 5EF                    United Kingdom",,,"IP7 5EF","United Kingdom",,,Babergh,,,,
https://www.afvbc.com/afvbc-uk-breakfast-clubs,"Halifax Armed Forces & Veterans Breakfast Clubs",,,,,,,,,,,,,,,,,,,,,,"Cafe Sports                         Ladyship Mills                    Old Lane                    Halifax                    HX3 5QN                    United Kingdom",,,"HX3 5QN","United Kingdom",,,Calderdale,,,,
https://www.afvbc.com/afvbc-uk-breakfast-clubs,"Halton Armed Forces & Veterans Breakfast Clubs",,,,,,,,,,,,,,,,,,,,,,"The Royal British Legion Club                         Castle Road                    Runcorn                    Cheshire                    WA7 2BE                    United Kingdom",,,"WA7 2BE","United Kingdom",,,Halton,,,,
https://www.afvbc.com/afvbc-uk-breakfast-clubs,"Harrogate Armed Forces & Veterans Breakfast Clubs",,,,,,,,,,,,,,,,,,,,,,"The Winter Gardens                         Parliament Street                    Unit 4                    Harrogate                    HG1 2RR                     United Kingdom",,,"HG1 2RR","United Kingdom",,,,,,,
https://www.afvbc.com/afvbc-uk-breakfast-clubs,"Hartlepool Armed Forces & Veterans Breakfast Clubs",,,,,,,,,,,,,,,,,,,,,,"The Jackson’s Wharf                         The Highlight                    Maritime Ave                    Hartlepool                    TS24 0XF                    United Kingdom",,,"TS24 0XF","United Kingdom",,,Hartlepool,,,,
https://www.afvbc.com/afvbc-uk-breakfast-clubs,"Harwich Armed Forces & Veterans Breakfast Clubs",,,,,,,,,,,,,,,,,,,,,,"The Bottle Kiln                         60 Kingsway                    Dovercourt                    Harwich Essex                    CO12 3JR                    United Kingdom",,,"CO12 3JR","United Kingdom",,,Tendring,,,,
https://www.afvbc.com/afvbc-uk-breakfast-clubs,"Hastings Armed Forces & Veterans Breakfast Clubs",,,,,,,,,,,,,,,,,,,,,,"The Windmill                         1 John Macadam Way                    Hastings                    Saint Leonards-on-sea, Sussex                    TN37 7DB                    United Kingdom",,,"TN37 7DB","United Kingdom",,,Hastings,,,,
https://www.afvbc.com/afvbc-uk-breakfast-clubs,"Hatfield Armed Forces & Veterans Breakfast Clubs",,,,,,,,,,,,,,,,,,,,,,"Harpsfield Hall (JD Wetherspoons)                         13a Parkhouse Court                    Hatfield                    Hertfordshire                    AL10 9RQ                    United Kingdom",,,"AL10 9RQ","United Kingdom",,,"Welwyn Hatfield",,,,
https://www.afvbc.com/afvbc-uk-breakfast-clubs,"Havant Armed Forces & Veterans Breakfast Clubs",,,,,,,,,,,,,,,,,,,,,,"Langbrook Farm                         2A Langstone Rd                     Havant                    PO9 1RE                    United Kingdom",,,"PO9 1RE","United Kingdom",,,Havant,,,,
https://www.afvbc.com/afvbc-uk-breakfast-clubs,"Haverhill Armed Forces & Veterans Breakfast Clubs",,,,,,,,,,,,,,,,,,,,,,"Nine Jars at The Suffolk Hotel                         9 High Street                    Haverhill                    CB9 8AA                    United Kingdom",,,"CB9 8AA","United Kingdom",,,"West Suffolk",,,,
https://www.afvbc.com/afvbc-uk-breakfast-clubs,"Hawkinge (Battle of Britain Museum) Armed Forces & Veterans Breakfast Clubs",,,,,,,,,,,,,,,,,,,,,,"The Battle of Britain Museum                         Hawkinge                    Kent                    CT8 7AG                    United Kingdom",,,"CT8 7AG","United Kingdom",,,,,,,
https://www.afvbc.com/afvbc-uk-breakfast-clubs,"Hayle Armed Forces & Veterans Breakfast Clubs",,,,,,,,,,,,,,,,,,,,,,"The Secret Kitchen                         East Quay                    Hayle                    Cornwall                    TR26 1AH                    United Kingdom",,,"TR26 1AH","United Kingdom",,,Cornwall,,,,
https://www.afvbc.com/afvbc-uk-breakfast-clubs,"Hayling Armed Forces & Veterans Breakfast Clubs",,,,,,,,,,,,,,,,,,,,,,"Hayling Voluntary Services                         Seniors Club                     13a Elm Grove                    PO11 9 EF                    United Kingdom",,,,"United Kingdom",,,,,,,
https://www.afvbc.com/afvbc-uk-breakfast-clubs,"Hazelmere Armed Forces & Veterans Breakfast Clubs",,,,,,,,,,,,,,,,,,,,,,"The Crown Hazlemere                         277 Amersham Road                    Hazlemere                    High Wycombe                    HP15 7QA                    United Kingdom",,,"HP15 7QA","United Kingdom",,,Buckinghamshire,,,,
https://www.afvbc.com/afvbc-uk-breakfast-clubs,"Hazlemere Armed Forces & Veterans Breakfast Clubs",,,,,,,,,,,,,,,,,,,,,,"The Crown                         277 Amersham Road                    Hazlemere                    High Wycombe                    HP15 7QA                    United Kingdom",,,"HP15 7QA","United Kingdom",,,Buckinghamshire,,,,
https://www.afvbc.com/afvbc-uk-breakfast-clubs,"Heacham Armed Forces & Veterans Breakfast Clubs",,,,,,,,,,,,,,,,,,,,,,"The Bushel & Strike                         24 Malthouse Crescent                    Heacham                    King&#039;s Lynn                    PE31 7DL                    United Kingdom",,,"PE31 7DL","United Kingdom",,,"King's Lynn and West Norfolk",,,,
https://www.afvbc.com/afvbc-uk-breakfast-clubs,"Helston Armed Forces & Veterans Breakfast Clubs",,,,,,,,,,,,,,,,,,,,,,"The Inn & Still                         36 Coinagehall Street                    Helston                    Cornwall                    TR13 8EQ                    United Kingdom",,,"TR13 8EQ","United Kingdom",,,Cornwall,,,,
https://www.afvbc.com/afvbc-uk-breakfast-clubs,"Hemel Armed Forces & Veterans Breakfast Clubs",,,,,,,,,,,,,,,,,,,,,,"The Full House                         128 Marlowes                    Hemel Hempstead                    HP1 1EZ                    United Kingdom",,,"HP1 1EZ","United Kingdom",,,Dacorum,,,,
https://www.afvbc.com/afvbc-uk-breakfast-clubs,"Hereford Armed Forces & Veterans Breakfast Clubs",,,,,,,,,,,,,,,,,,,,,,"The Kings Fee                         49-53 Commercial Street                    Hereford                    Herefordshire                    HR1 2BJ                    United Kingdom",,,"HR1 2BJ","United Kingdom",,,"Herefordshire, County of",,,,
https://www.afvbc.com/afvbc-uk-breakfast-clubs,"Hertfordshire, Bedfordshire & Cambridgeshire Armed Forces & Veterans Breakfast Clubs",,,,,,,,,,,,,,,,,,,,,,"VARIOUS LOCATION                         MAP LOCATION IS NOT                    MEETING LOCATION UNLESS                    STATED ON FACEBOOK",,,,"United Kingdom",,,,,,,
https://www.afvbc.com/afvbc-uk-breakfast-clubs,"Hexham Armed Forces & Veterans Breakfast Clubs",,,,,,,,,,,,,,,,,,,,,,"The County Hotel                         Priestpopple                    Hexham                    Northumberland                    NE46 1PS                    United Kingdom",,,"NE46 1PS","United Kingdom",,,Northumberland,,,,
https://www.afvbc.com/afvbc-uk-breakfast-clubs,"High Wycombe Armed Forces & Veterans Breakfast Clubs",,,,,,,,,,,,,,,,,,,,,,"The Spindle & Thread                         Bellfield Road                    High Wycombe                    Bucks                    HP13 5HP                    United Kingdom",,,"HP13 5HP","United Kingdom",,,Buckinghamshire,,,,
https://www.afvbc.com/afvbc-uk-breakfast-clubs,"High Wycombe (East) Armed Forces & Veterans Breakfast Clubs",,,,,,,,,,,,,,,,,,,,,,"Papermill Brewers Fayre                         London Road                    Loudwater                    High Wycombe                    HP10 9YL                    United Kingdom",,,"HP10 9YL","United Kingdom",,,Buckinghamshire,,,,
https://www.afvbc.com/afvbc-uk-breakfast-clubs,"Hinckley Armed Forces & Veterans Breakfast Clubs , By Veterans For Veterans",,,,,,,,,,,,,,,,,,,,,,"Hansom Cab                         Brookfield Road                    Hinckley                    Leicestershire                    LE10 2LL                    United Kingdom",,,"LE10 2LL","United Kingdom",,,"Hinckley and Bosworth",,,,
https://www.afvbc.com/afvbc-uk-breakfast-clubs,"Holton le Clay Armed Forces & Veterans Breakfast Clubs",,,,,,,,,,,,,,,,,,,,,,"Holton le Clay Cricket Club                         Tetney Lane                    Holton le Clay                    Grimsby, Lincolnshire                    DN36 5AS                    United Kingdom",,,"DN36 5AS","United Kingdom",,,"East Lindsey",,,,
https://www.afvbc.com/afvbc-uk-breakfast-clubs,"Hoo Armed Forces & Veterans Breakfast Clubs",,,,,,,,,,,,,,,,,,,,,,"Taggs Coffee Shop                         25 Church Street                    Hoo                    Kent                    ME3 9AH                    United Kingdom",,,"ME3 9AH","United Kingdom",,,Medway,,,,
https://www.afvbc.com/afvbc-uk-breakfast-clubs,"Horncastle Armed Forces & Veterans Breakfast Clubs",,,,,,,,,,,,,,,,,,,,,,"The Bull Hotel                         Bull Ring                    Horncastle                    Lincolnshire                    LN95HU                    United Kingdom",,,LN95HU,"United Kingdom",,,"East Lindsey",,,,
https://www.afvbc.com/afvbc-uk-breakfast-clubs,"Hornsea Armed Forces & Veterans Breakfast Clubs",,,,,,,,,,,,,,,,,,,,,,"Thyme & Tide Restaurant                         26 Newbegin                    Hornsea                    HU18 1AD                    United Kingdom",,,"HU18 1AD","United Kingdom",,,"East Riding of Yorkshire",,,,
https://www.afvbc.com/afvbc-uk-breakfast-clubs,"Houghton (RUFC) Armed Forces & Veterans Breakfast Clubs",,,,,,,,,,,,,,,,,,,,,,"The Houghton Rugby Club                         Dairy Lane                    Houghton le Spring                    Sunderland                    DH4 5BW                    United Kingdom",,,"DH4 5BW","United Kingdom",,,Sunderland,,,,
https://www.afvbc.com/afvbc-uk-breakfast-clubs,"Huddersfield Armed Forces & Veterans Breakfast Clubs",,,,,,,,,,,,,,,,,,,,,,"The Lord Wilson (Wetherspoon)                         Unit 27                    King Street                    Huddersfield                    HD1 2PZ                    United Kingdom",,,"HD1 2PZ","United Kingdom",,,Kirklees,,,,
https://www.afvbc.com/afvbc-uk-breakfast-clubs,"Hull (East) Armed Forces & Veterans Breakfast Clubs",,,,,,,,,,,,,,,,,,,,,,"The Lambwath                         Sutton Road                    Hull                    HU8 0HU                    United Kingdom",,,"HU8 0HU","United Kingdom",,,"Kingston upon Hull, City of",,,,
https://www.afvbc.com/afvbc-uk-breakfast-clubs,"Hull (East, Saturday & Sunday) Armed Forces & Veterans Breakfast Clubs",,,,,,,,,,,,,,,,,,,,,,"Robins Cafe                         348 Preston Rd                    Hull                    HU9 5HH                    United Kingdom",,,"HU9 5HH","United Kingdom",,,"Kingston upon Hull, City of",,,,
https://www.afvbc.com/afvbc-uk-breakfast-clubs,"Hull (HMP) Armed Forces & Veterans Breakfast Clubs",,,,,,,,,,,,,,,,,,,,,,"HMP Hull                         Hedon Road                    Hull                    HU9 5LS                    United Kingdom",,,"HU9 5LS","United Kingdom",,,"Kingston upon Hull, City of",,,,
https://www.afvbc.com/afvbc-uk-breakfast-clubs,"Hythe Armed Forces & Veterans Breakfast Clubs",,,,,,,,,,,,,,,,,,,,,,"Lord Nelson                         5 High St                    Hythe                    Southampton                     SO45 6AG                    United Kingdom",,,"SO45 6AG","United Kingdom",,,"New Forest",,,,
https://www.afvbc.com/afvbc-uk-breakfast-clubs,"Ilkley Armed Forces & Veterans Breakfast Clubs",,,,,,,,,,,,,,,,,,,,,,"The Listers Arms                         14 The Moors Shopping Centre                     South Hawksworth Street                    Ilkley, West Yorkshire                     LS29 9LB                    United Kingdom",,,"LS29 9LB","United Kingdom",,,Bradford,,,,
https://www.afvbc.com/afvbc-uk-breakfast-clubs,"Invergordon (Easter Ross) Armed Forces & Veterans Breakfast Clubs",,,,,,,,,,,,,,,,,,,,,,"Grounded Cafe                         Olbsdale Road                    Alness                    IV17 0TY                    United Kingdom",,,"IV17 0TY","United Kingdom",,,Highland,,,,
https://www.afvbc.com/afvbc-uk-breakfast-clubs,"Inverness Armed Forces & Veterans Breakfast Clubs",,,,,,,,,,,,,,,,,,,,,,"The Royal British Legion Club                         17 King Street                    Inverness                    IV3 5DF                    United Kingdom",,,"IV3 5DF","United Kingdom",,,Highland,,,,
https://www.afvbc.com/afvbc-uk-breakfast-clubs,"Inverurie Armed Forces & Veterans Breakfast Clubs",,,,,,,,,,,,,,,,,,,,,,"The Gordon Highlander                         25 West High Street                    Inverurie                    Scotland                    AB51 3QS                    United Kingdom",,,"AB51 3QS","United Kingdom",,,Aberdeenshire,,,,
https://www.afvbc.com/afvbc-uk-breakfast-clubs,"Ipswich Armed Forces & Veterans Breakfast Clubs",,,,,,,,,,,,,,,,,,,,,,"The Smock                         69 Maidenhall Approach                    Ipswich                    Suffolk                    IP2 8PG                    United Kingdom",,,"IP2 8PG","United Kingdom",,,Ipswich,,,,
https://www.afvbc.com/afvbc-uk-breakfast-clubs,"Isle of Islay Armed Forces & Veterans Breakfast Clubs",,,,,,,,,,,,,,,,,,,,,,"Lochindaal Hotel                         10 Main St                    Port Charlotte                    Isle of Islay, Argyle                    PA48 7TX                    United Kingdom",,,"PA48 7TX","United Kingdom",,,"Argyll and Bute",,,,
https://www.afvbc.com/afvbc-uk-breakfast-clubs,"Isle of Skye Armed Forces & Veterans Breakfast Clubs",,,,,,,,,,,,,,,,,,,,,,"The Red Brick Cafe @ Jans                         6 Broom Place                    Portree, Isle of Skye                    IV51 9HL                    United Kingdom",,,"IV51 9HL","United Kingdom",,,Highland,,,,
https://www.afvbc.com/afvbc-uk-breakfast-clubs,"Isle of Wight Armed Forces & Veterans Breakfast Clubs",,,,,,,,,,,,,,,,,,,,,,"The Walled Garden Café                         14 Holyrood Street                    Newport                    Isle of Wight                    PO30 5A                    United Kingdom",,,,"United Kingdom",,,,,,,
https://www.afvbc.com/afvbc-uk-breakfast-clubs,"Islington Armed Forces & Veterans Breakfast Clubs",,,,,,,,,,,,,,,,,,,,,,"St Luke&#039;s Community Centre                         90 Central Street                    London                    Islington                    EC1V 8AJ                    United Kingdom",,,,"United Kingdom",,,,,,,
https://www.afvbc.com/afvbc-uk-breakfast-clubs,"Kidderminster Armed Forces & Veterans Breakfast Clubs",,,,,,,,,,,,,,,,,,,,,,"Larch Wood Farm                         Silverwoods                    Kidderminster                    Worcestershire                    DY11 7DY                    United Kingdom",,,"DY11 7DY","United Kingdom",,,"Wyre Forest",,,,
https://www.afvbc.com/afvbc-uk-breakfast-clubs,"Kidsgrove Armed Forces & Veterans Breakfast Clubs",,,,,,,,,,,,,,,,,,,,,,"The Plough Inn                         105 Liverpool Road                    Kidsgrove                    Stoke-on-Trent                    ST7 4EW                    United Kingdom",,,"ST7 4EW","United Kingdom",,,Newcastle-under-Lyme,,,,
https://www.afvbc.com/afvbc-uk-breakfast-clubs,"Kilmarnock AFVBC",,,,,,,,,,,,,,,,,,,,,,"Rock Diner and Aces                          St Marnock Place                     Kilmarnock                    Ayrshire                    KA1 1DU                    United Kingdom",,,"KA1 1DU","United Kingdom",,,"East Ayrshire",,,,
https://www.afvbc.com/afvbc-uk-breakfast-clubs,"Kirkby (Ashfield) Armed Forces & Veterans Breakfast Clubs",,,,,,,,,,,,,,,,,,,,,,"Larwood Park (Ashfield RUFC)                          Twickenham Road                    Kirkby-in-Ashfield                    Nottingham                    NG17 8SF                    United Kingdom",,,"NG17 8SF","United Kingdom",,,Ashfield,,,,
https://www.afvbc.com/afvbc-uk-breakfast-clubs,"Knott End-on-Sea Armed Forces & Veterans Breakfast Clubs",,,,,,,,,,,,,,,,,,,,,,"‘The Bourne Arms&#039;                          Bourne May Road                    Knott End-on-Sea                    Poulton-le-Fylde                    FY6 0AB                    United Kingdom",,,"FY6 0AB","United Kingdom",,,Wyre,,,,
https://www.afvbc.com/afvbc-uk-breakfast-clubs,"Lambeth Armed Forces & Veterans Breakfast Clubs",,,,,,,,,,,,,,,,,,,,,,"The Beehive                         407-409 Brixton Road                    Brixton                    London                    SW9 7DG                    United Kingdom",,,"SW9 7DG","United Kingdom",,,Lambeth,,,,
https://www.afvbc.com/afvbc-uk-breakfast-clubs,"Airdrie (North Lanarkshire) Armed Forces Veterans Breakfast Club",,,,,,,,,,,,,,,,,,,,,,"Newhouse Beefeater                         Edinburgh Road                    Motherwell                    North Lanarkshire                    ML1 5SV                    United Kingdom",,,"ML1 5SV","United Kingdom",,,,,,,
