https://www.afvbc.com/afvbc-uk-breakfast-clubs,"Hull (East) Armed Forces & Veterans Breakfast Clubs","+44(0)1482 376156",,https://www.afvbc.com/event/hull-east-armed-forces-veterans-breakfast-club,,,,,https://www.facebook.com/groups/BarkersBreakfastClub,,,,,,,,,,,,,"The Lambwath, Sutton Road","The Lambwath Sutton Road Hull HU8 0HU United Kingdom",53.77461276,-0.3078693151,"HU8 0HU","United Kingdom",,,Hull,"EVERY Saturday 0930hrs (onwards)",,,
https://www.afvbc.com/afvbc-uk-breakfast-clubs,"Hull (East, Saturday & Sunday) Armed Forces & Veterans Breakfast Clubs","+44(0)7748 058252",,https://www.afvbc.com/event/hull-saturday-sunday-armed-forces-veterans-breakfast-club,,,,,https://www.facebook.com/groups/145258916195484,,,,,,,,,,,,,"Robins Cafe, 348 Preston Rd","Robins Cafe 348 Preston Rd Hull HU9 5HH United Kingdom",53.7562471,-0.2651041746,"HU9 5HH","United Kingdom",,,Hull,"EVERY Saturday & Sunday 0930hrs - 1100hrs",,,
https://www.afvbc.com/afvbc-uk-breakfast-clubs,"Hull (HMP) Armed Forces & Veterans Breakfast Clubs","+44(0)1482 282200",,https://www.afvbc.com/event/hull-hmp-armed-forces-veterans-breakfast-club,,,,,https://www.facebook.com/groups/afvbc.hmp.hull/,,,,,,,,,,,,,"HMP Hull, Hedon Road","HMP Hull Hedon Road Hull HU9 5LS United Kingdom",53.74791538,-0.2967260778,"HU9 5LS","United Kingdom",,,Hull,"ONE Wednesday (per month) 1000hrs (JOIN Facebook for Date)",,,
https://www.afvbc.com/afvbc-uk-breakfast-clubs,"Hythe Armed Forces & Veterans Breakfast Clubs","+44(0)2380 842169",,https://www.afvbc.com/event/hythe-armed-forces-veterans-breakfast-club,,,,,https://www.facebook.com/profile.php?id=100081962273235,,,,,,,,,,,,,"Lord Nelson, 5 High St, Hythe","Lord Nelson 5 High St Hythe Southampton SO45 6AG United Kingdom",50.87048388,-1.398943663,"SO45 6AG","United Kingdom",,,Southampton,"SECOND Saturday (of the month) 1000hrs (onwards)",,,
https://www.afvbc.com/afvbc-uk-breakfast-clubs,"Ilkley Armed Forces & Veterans Breakfast Clubs","+44(0)1943 811240",,https://www.afvbc.com/event/Ilkley-armed-forces-veterans-breakfast-club,,,,,https://www.facebook.com/groups/432993785302563/,,,,,,,,,,,,,"The Listers Arms, 14 The Moors Shopping Centre, South Hawksworth Street","The Listers Arms 14 The Moors Shopping Centre South Hawksworth Street Ilkley, West Yorkshire LS29 9LB United Kingdom",53.92572757,-1.825822592,"LS29 9LB","United Kingdom",,,Ilkley,"LAST Saturday (of the month) 1000hrs (onwards)",,,
https://www.afvbc.com/afvbc-uk-breakfast-clubs,"Invergordon (Easter Ross) Armed Forces & Veterans Breakfast Clubs","+44(0)7802 416899",,https://www.afvbc.com/event/invergordon-easter-ross-armed-forces-veterans-breakfast-club,,,,,https://www.facebook.com/groups/InvergordonEasterRossAFVBC,,,,,,,,,,,,,"Grounded Cafe, Olbsdale Road","Grounded Cafe Olbsdale Road Alness IV17 0TY United Kingdom",57.69557923,-4.2496667,"IV17 0TY","United Kingdom",,,Alness,"LAST Saturday (of the month) 1030hrs - 1230hrs",,,
https://www.afvbc.com/afvbc-uk-breakfast-clubs,"Inverness Armed Forces & Veterans Breakfast Clubs","+44(0)1463 233710",,https://www.afvbc.com/event/inverness-armed-forces-veterans-breakfast-club,,,,,https://www.facebook.com/groups/InvernessAFVBC,,,,,,,,,,,,,"The Royal British Legion Club, 17 King Street","The Royal British Legion Club 17 King Street Inverness IV3 5DF United Kingdom",57.47712714,-4.229645133,"IV3 5DF","United Kingdom",,,Inverness,"FORTNIGHTLY (on a) Friday 1000hrs - 1130hrs",,,
https://www.afvbc.com/afvbc-uk-breakfast-clubs,"Inverurie Armed Forces & Veterans Breakfast Clubs","+44(0)1467 626780",,https://www.afvbc.com/event/inverurie-armed-forces-veterans-breakfast-club,,,,,https://www.facebook.com/groups/afvbc.inverurie,,,,,,,,,,,,,"The Gordon Highlander, 25 West High Street","The Gordon Highlander 25 West High Street Inverurie Scotland AB51 3QS United Kingdom",57.28482436,-2.379645109,"AB51 3QS","United Kingdom",,,Inverurie,"FIRST Saturday (of the month) 1000hrs (onwards)",,,
https://www.afvbc.com/afvbc-uk-breakfast-clubs,"Ipswich Armed Forces & Veterans Breakfast Clubs","+44(0)1473 805008",,https://www.afvbc.com/event/ipswich-armed-forces-veterans-breakfast-club,,,,,https://www.facebook.com/groups/910403279003748/,,,,,,,,,,,,,"The Smock, 69 Maidenhall Approach","The Smock 69 Maidenhall Approach Ipswich Suffolk IP2 8PG United Kingdom",52.04208818,1.147202253,"IP2 8PG","United Kingdom",,,Ipswich,"EVERY Saturday 0930hrs (onwards)",,,
https://www.afvbc.com/afvbc-uk-breakfast-clubs,"Isle of Islay Armed Forces & Veterans Breakfast Clubs","+44(0)1496 850202",,https://www.afvbc.com/event/isle-of-islay-armed-forces-veterans-breakfast-club,,,,,https://www.facebook.com/groups/700814033668568/,,,,,,,,,,,,,"Lochindaal Hotel, 10 Main St, Port Charlotte","Lochindaal Hotel 10 Main St Port Charlotte Isle of Islay, Argyle PA48 7TX United Kingdom",55.73902871,-6.378561258,"PA48 7TX","United Kingdom",,,"Isle of Islay","EVERY Saturday 1000hrs (onwards)",,,
https://www.afvbc.com/afvbc-uk-breakfast-clubs,"Isle of Skye Armed Forces & Veterans Breakfast Clubs","+44(0)1478 613417",,https://www.afvbc.com/event/isle-of-skye-armed-forces-veterans-breakfast-club,,,,,https://www.facebook.com/groups/1280447362049869/,,,,,,,,,,,,,"The Red Brick Cafe @ Jans, 6 Broom Place","The Red Brick Cafe @ Jans 6 Broom Place Portree, Isle of Skye IV51 9HL United Kingdom",57.42080623,-6.210499406,"IV51 9HL","United Kingdom",,,Portree,"FIRST Saturday (of the month) 0900hrs (onwards)",,,
https://www.afvbc.com/afvbc-uk-breakfast-clubs,"Isle of Wight Armed Forces & Veterans Breakfast Clubs","+44(0)1983 716768",,https://www.afvbc.com/event/isle-of-wight-armed-forces-veterans-breakfast-club,,,,,https://www.facebook.com/groups/,,,,,,,,,,,,,"The Walled Garden Cafe, 14 Holyrood Street","The Walled Garden CafÃ© 14 Holyrood Street Newport Isle of Wight PO30 5A United Kingdom",50.70117719,-1.293720603,"PO30 5A","United Kingdom",,,Newport,"FIRST Sunday (of every month) 1000hrs - 1200hrs",,,
https://www.afvbc.com/afvbc-uk-breakfast-clubs,"Islington Armed Forces & Veterans Breakfast Clubs","+44(0)2075 498181",,https://www.afvbc.com/event/islington-armed-forces-veterans-breakfast-club,,,,,https://www.facebook.com/groups/156338698269620/,,,,,,,,,,,,,"St Luke's Community Centre, 90 Central Street","St Luke's Community Centre 90 Central Street London Islington EC1V 8AJ United Kingdom",51.52649134,-0.0964307785,"EC1V 8AJ","United Kingdom",,,London,"THIRD Friday (of the month) 0900hrs - 1100hrs",,,
https://www.afvbc.com/afvbc-uk-breakfast-clubs,"Kidderminster Armed Forces & Veterans Breakfast Clubs","+44(0)1562 549069",,https://www.afvbc.com/event/kidderminster-armed-forces-veterans-breakfast-club,,,,,https://www.facebook.com/groups/109988539611771,,,,,,,,,,,,,"Larch Wood Farm, Silverwoods","Larch Wood Farm Silverwoods Kidderminster Worcestershire DY11 7DY United Kingdom",52.37021822,-2.259069085,"DY11 7DY","United Kingdom",,,Kidderminster,"EVERY Saturday 0900hrs - 1100hrs",,,
https://www.afvbc.com/afvbc-uk-breakfast-clubs,"Kidsgrove Armed Forces & Veterans Breakfast Clubs","+44(0)770 7114437",,https://www.afvbc.com/event/kidsgrove-armed-forces-veterans-breakfast-club,,,,,,,,,,,,,,,,,,"The Plough Inn, 105 Liverpool Road, Kidsgrove","The Plough Inn 105 Liverpool Road Kidsgrove Stoke-on-Trent ST7 4EW United Kingdom",53.08505085,-2.236424536,"ST7 4EW","United Kingdom",,,Stoke-on-Trent,"SECOND Saturday (of the month) 0930hrs (onwards)",,,
https://www.afvbc.com/afvbc-uk-breakfast-clubs,"Kilmarnock AFVBC","+44(0)1563 544344",,https://www.afvbc.com/event/kilmarnock-armed-forces-veterans-breakfast-club,,,,,https://www.facebook.com/groups/1257209801085199,,,,,,,,,,,,,"Rock Diner and Aces, St Marnock Place","Rock Diner and Aces St Marnock Place Kilmarnock Ayrshire KA1 1DU United Kingdom",55.60821752,-4.497882128,"KA1 1DU","United Kingdom",,,Kilmarnock,"SECOND Sunday (of the month) 1000hrs - 1200hrs",,,
https://www.afvbc.com/afvbc-uk-breakfast-clubs,"Kirkby (Ashfield) Armed Forces & Veterans Breakfast Clubs","+44(0)745 6096782",,https://www.afvbc.com/event/kirkby-ashfield-armed-forces-veterans-breakfast-club,,,,,https://www.facebook.com/groups/330737917702452,,,,,,,,,,,,,"Larwood Park (Ashfield RUFC), Twickenham Road, Kirkby-in-Ashfield","Larwood Park (Ashfield RUFC) Twickenham Road Kirkby-in-Ashfield Nottingham NG17 8SF United Kingdom",53.11178937,-1.265621781,"NG17 8SF","United Kingdom",,,Nottingham,"THIRD Saturday (of the month) 1000hrs (onwards)",,,
https://www.afvbc.com/afvbc-uk-breakfast-clubs,"Knott End-on-Sea Armed Forces & Veterans Breakfast Clubs","+44(0)1253 810400",,https://www.afvbc.com/event/knott-end-on-sea-armed-forces-veterans-breakfast-club,,,,,https://www.facebook.com/groups/knott.end.on.sea.afvbc/,,,,,,,,,,,,,"The Bourne Arms', Bourne May Road, Knott End-on-Sea","The Bourne Arms' Bourne May Road Knott End-on-Sea Poulton-le-Fylde FY6 0AB United Kingdom",53.92844006,-2.99537167,"FY6 0AB","United Kingdom",,,Poulton-le-Fylde,"THIRD Saturday (of every month) 0900hrs (onwards)",,,
https://www.afvbc.com/afvbc-uk-breakfast-clubs,"Lambeth Armed Forces & Veterans Breakfast Clubs","+44(0)2077 383643",,https://www.afvbc.com/event/lambeth-armed-forces-veterans-breakfast-club,,,,,https://www.facebook.com/groups/224396022242376/,,,,,,,,,,,,,"The Beehive, 407-409 Brixton Road, Brixton","The Beehive 407-409 Brixton Road Brixton London SW9 7DG United Kingdom",51.46377101,-0.1143935323,"SW9 7DG","United Kingdom",,,London,"FIRST Sunday (of the month) 1000hrs (onwards)",,,
https://www.afvbc.com/afvbc-uk-breakfast-clubs,"Airdrie (North Lanarkshire) Armed Forces Veterans Breakfast Club","+44(0)1698 860277",,https://www.afvbc.com/event/airdrie-north-lanarkshire-armed-forces-veterans-breakfast-club,,,,,https://www.facebook.com/groups/857944557626780,,,,,,,,,,,,,"Newhouse Beefeater, Edinburgh Road","Newhouse Beefeater Edinburgh Road Motherwell North Lanarkshire ML1 5SV United Kingdom",55.83111953,-3.929972649,"ML1 5SV","United Kingdom",,,Motherwell,"THIRD Sunday (of the month) 1000hrs (onwards)",,,
https://www.afvbc.com/afvbc-uk-breakfast-clubs,"Largs Armed Forces & Veterans Breakfast Clubs","+44(0)7393 384637",,https://www.afvbc.com/event/largs-armed-forces-veterans-breakfast-club,,,,,https://www.facebook.com/groups/562509034262627,,,,,,,,,,,,,"Indigo Eats, 68 Gallowgate Street","Indigo Eats 68 Gallowgate Street Largs KA30 8LZ United Kingdom",55.79562112,-4.869405627,"KA30 8LZ","United Kingdom",,,Largs,"EVERY Tuesday 1000hrs (onwards)",,,
https://www.afvbc.com/afvbc-uk-breakfast-clubs,"Larne Armed Forces & Veterans Breakfast Clubs",,,https://www.afvbc.com/event/larne-armed-forces-veterans-breakfast-club,,,,,https://www.facebook.com/groups/2022351511420541,,,,,,,,,,,,,,,54.85892688,-5.824636139,,"United Kingdom",,,,"VISIT FACEBOOK FOR DATES AND TIMES",,,
https://www.afvbc.com/afvbc-uk-breakfast-clubs,"Launceston Armed Forces & Veterans Breakfast Clubs","+44(0)1566 778988",,https://www.afvbc.com/event/launceston-armed-forces-veterans-breakfast-club,,,,,https://www.facebook.com/groups/1115522705155244/,,,,,,,,,,,,,"Launceston British Legion, Westgate Street","Launceston British Legion Westgate Street Launceston PL15 7AE United Kingdom",50.63537877,-4.36268735,"PL15 7AE","United Kingdom",,,Launceston,"EVERY Saturday 0930hrs - 1200hrs",,,
https://www.afvbc.com/afvbc-uk-breakfast-clubs,"Leeds (North) Armed Forces & Veterans Breakfast Clubs","+44(0)1132 637096",,https://www.afvbc.com/event/leeds-north-armed-forces-veterans-breakfast-club,,,,,https://www.facebook.com/groups/937610259610024/,,,,,,,,,,,,,"Travellers Rest, 49 Hill Top Road, Armley","Travellers Rest 49 Hill Top Road Armley Leeds LS123PY United Kingdom",53.79929798,-1.609346867,LS123PY,"United Kingdom",,,Leeds,"LAST Sunday (of the month) 1000hrs (onwards)",,,
https://www.afvbc.com/afvbc-uk-breakfast-clubs,"Leicester (Central) Armed Forces & Veterans Breakfast Clubs","+44(0)1162 555492",,https://www.afvbc.com/event/leicester-central-armed-forces-veterans-breakfast-club,,,,,https://www.facebook.com/groups/170967673416243/,,,,,,,,,,,,,"The Last Plantagenet, 107 Granby Street","The Last Plantagenet 107 Granby Street Leicester Leicestershire LE1 6FD United Kingdom",52.63273822,-1.12861195,"LE1 6FD","United Kingdom",,,Leicester,"THIRD Saturday (of the month) 0930hrs (onwards)",,,
https://www.afvbc.com/afvbc-uk-breakfast-clubs,"Leigh Armed Forces & Veterans Breakfast Clubs","+44(0)1942 685640",,https://www.afvbc.com/event/leigh-armed-forces-veterans-breakfast-club,,,,,https://www.facebook.com/groups/LeighBreakfastClub/,,,,,,,,,,,,,"The Thomas Burke","The Thomas Burke Leigh Greater Manchester WN7 1QR United Kingdom",53.49935569,-2.519018054,"WN7 1QR","United Kingdom",,,Leigh,"EVERY Saturday 1000hrs (onwards)",,,
https://www.afvbc.com/afvbc-uk-breakfast-clubs,"Leominster Armed Forces & Veterans Breakfast Clubs","+44(0)1568 618170",,https://www.afvbc.com/event/leominster-armed-forces-veterans-breakfast-club,,,,,https://www.facebook.com/groups/404363500018193,,,,,,,,,,,,,"The Dukes Head, 3 Corn Square","The Dukes Head 3 Corn Square Leominster Herefordshire HR6 8LR United Kingdom",52.22716853,-2.73797214,"HR6 8LR","United Kingdom",,,Leominster,"FORTNIGHTLY Saturday 0930hrs (onwards)",,,
https://www.afvbc.com/afvbc-uk-breakfast-clubs,"Leyland Armed Forces & Veterans Breakfast Clubs","+44(0)7921 083728",,https://www.afvbc.com/event/leyland-armed-forces-veterans-breakfast-club,,,,,https://www.facebook.com/groups/327990634286342/,,,,,,,,,,,,,"St Ambrose Church Halls, 44 Moss Lane","St Ambrose Church Halls 44 Moss Lane Leyland PR25 4SH United Kingdom",53.69833258,-2.683185339,"PR25 4SH","United Kingdom",,,Leyland,"FIRST & THIRD Saturday (of the month) 1000hrs (onwards)",,,
https://www.afvbc.com/afvbc-uk-breakfast-clubs,"Lichfield & Rugeley Armed Forces & Veterans Breakfast Clubs","+44(0)1543 256822",,https://www.afvbc.com/event/lichfield-armed-forces-veterans-breakfast-club,,,,,https://www.facebook.com/groups/lichfieldafvbc/,,,,,,,,,,,,,"The Kings Head, 21 Bird Street","The Kings Head 21 Bird Street Lichfield Staffs WS13 6PW United Kingdom",52.68299269,-1.830428445,"WS13 6PW","United Kingdom",,,Lichfield,"LAST Saturday (of every month) 1000hrs (onwards)",,,
https://www.afvbc.com/afvbc-uk-breakfast-clubs,"Limassol & WSBA Armed Forces & Veterans Breakfast Clubs",,,https://www.afvbc.com/event/limassol-wsba-armed-forces-veterans-breakfast-club,,,,,https://www.facebook.com/groups/limassolwsba/,,,,,,,,,,,,,"British Food Vendor, Market Mall (at rear), Ypsonis, Limassol 4630, Cyprus","British Food Vendor Market Mall (at rear) Ypsonis Limassol 4630 Cyprus",34.68338701,32.97070195,,"United Kingdom",,,Limassol,"FIRST & THIRD Saturday (of the month) 1000hrs (onwards)",,,
https://www.afvbc.com/afvbc-uk-breakfast-clubs,"Lincoln Armed Forces & Veterans Breakfast Clubs","+44(0)1522 696916",,https://www.afvbc.com/event/lincoln-armed-forces-veterans-breakfast-club,,,,,https://www.facebook.com/groups/453663844839129/,,,,,,,,,,,,,"Lake View Restaurant, Moor Lane, Thorpe on the Hill","Lake View Restaurant Moor Lane Thorpe on the Hill LN6 9BW United Kingdom",53.18476712,-0.6334090233,"LN6 9BW","United Kingdom",,,Lincoln,"FORTNIGHTLY Saturday 1000hrs (onwards)",,,
https://www.afvbc.com/afvbc-uk-breakfast-clubs,"Liskeard Armed Forces & Veterans Breakfast Clubs","+44(0)7788 563188",,https://www.afvbc.com/event/liskeard-armed-forces-veterans-breakfast-club,,,,,https://www.facebook.com/groups/colburn.afvbc/,,,,,,,,,,,,,"The Market Cafe, Liskeard, Cornwall, North Yorkshire","The Market Cafe Liskeard Cornwall North Yorkshire PL14 4AA United Kingdom",50.45346872,-4.466721565,"PL14 4AA","United Kingdom",,,,"SECOND Saturday (of every month) 0930hrs (onwards)",,,
https://www.afvbc.com/afvbc-uk-breakfast-clubs,"Littlehampton Armed Forces & Veterans Breakfast Clubs","+44(0)7728 760246",,https://www.afvbc.com/event/littlehampton-armed-forces-veterans-breakfast-club,,,,,https://www.facebook.com/groups/405660983222699/,,,,,,,,,,,,,"The Old Corn Store Bar & Bistro, 72 High Street","The Old Corn Store Bar & Bistro 72 High Street Littlehampton West Sussex BN17 5DX United Kingdom",50.80931922,-0.5415951,"BN17 5DX","United Kingdom",,,Littlehampton,"EVERY Wednesday & Saturday 1000hrs - 1200hrs",,,
https://www.afvbc.com/afvbc-uk-breakfast-clubs,"Liverpool (Merseyside) Armed Forces & Veterans Breakfast Clubs","+44(0)151 236 2131",,https://www.afvbc.com/event/liverpool-merseyside-armed-forces-veterans-breakfast-club,,,,,https://www.facebook.com/groups/775495462515522/,,,,,,,,,,,,,"Cornmarket Pub, Old Ropery","Cornmarket Pub Old Ropery Liverpool L2 7NT United Kingdom",53.40543932,-2.99165425,"L2 7NT","United Kingdom",,,Liverpool,"FIRST Saturday (of the month) 1300hrs (onwards)",,,
https://www.afvbc.com/afvbc-uk-breakfast-clubs,"Livingston (North) Armed Forces & Veterans Breakfast Clubs","+44(0)1506 243991",,https://www.afvbc.com/event/livingston-armed-forces-veterans-breakfast-club,,,,,https://www.facebook.com/groups/livingstonafvbc/,,,,,,,,,,,,,"Chain Runner, Almondvale Way","Chain Runner Almondvale Way Livingston West Lothian EH54 6GA United Kingdom",55.88055589,-3.525652438,"EH54 6GA","United Kingdom",,,Livingston,"SECOND Saturday (of the month) 0930hrs (onwards)",,,
https://www.afvbc.com/afvbc-uk-breakfast-clubs,"Llanfairfechan Armed Forces & Veterans Breakfast Clubs","+44(0)1248 680035",,https://www.afvbc.com/event/llanfairfechan-armed-forces-veterans-breakfast-club,,,,,https://www.facebook.com/groups/afvbc.llanfairfechan/,,,,,,,,,,,,,"Beach Pavilion Cafe, Promenade","Beach Pavilion Cafe Promenade Llanfairfechan LL33 0BY United Kingdom",53.25958401,-3.981424123,"LL33 0BY","United Kingdom",,,Llanfairfechan,"EVERY Friday 1030hrs (onwards)",,,
https://www.afvbc.com/afvbc-uk-breakfast-clubs,"Llangrove Armed Forces & Veterans Breakfast Clubs","+44(0)1989 770267",,https://www.afvbc.com/event/llangrove-armed-forces-veterans-breakfast-club,,,,,https://www.facebook.com/groups/361036675566528/,,,,,,,,,,,,,"The Royal Arms, Llangrove","The Royal Arms Llangrove Ross-on-Wye Herefordshire HR9 6EZ United Kingdom",51.87050289,-2.692680359,"HR9 6EZ","United Kingdom",,,Ross-on-Wye,"EVERY Saturday 0930hrs (onwards)",,,
https://www.afvbc.com/afvbc-uk-breakfast-clubs,"Lochgilphead Armed Forces & Veterans Breakfast Clubs","+44(0)1546 606039",,https://www.afvbc.com/event/lochgilphead-armed-forces-veterans-breakfast-club,,,,,https://www.facebook.com/groups/1701996360075851/,,,,,,,,,,,,,"The Rumbling Tum Cafe, 87 Chalmers Street, Ardrishaig","The Rumbling Tum Cafe 87 Chalmers Street Ardrishaig PA30 8DX United Kingdom",56.01463683,-5.447715372,"PA30 8DX","United Kingdom",,,Lochgilphead,"Visit Facebook For Times",,,
https://www.afvbc.com/afvbc-uk-breakfast-clubs,"Long Eaton Armed Forces & Veterans Breakfast Clubs","+44(0)7912 601475",,https://www.afvbc.com/event/long-eaton-armed-forces-veterans-breakfast-club,,,,,https://www.facebook.com/groups/451999041576585/,,,,,,,,,,,,,"The Stumble Inn, 37 Tamworth Road, Long Eaton, Nottinghamshire","The Stumble Inn 37 Tamworth Road Long Eaton Nottinghamshire NG10 1JF United Kingdom",52.89594639,-1.272155643,"NG10 1JF","United Kingdom",,,Nottingham,"SECOND Sunday (of every month) 0930hrs (onwards)",,,
https://www.afvbc.com/afvbc-uk-breakfast-clubs,"Lowestoft Armed Forces & Veterans Breakfast Clubs","+44(0)1502 573564",,https://www.afvbc.com/event/lowestoft-armed-forces-veterans-breakfast-club,,,,,https://www.facebook.com/groups/205670523304888/,,,,,,,,,,,,,"Lord Kitcheners Guest House, 10 Kirkley Cliff","Lord Kitcheners Guest House 10 Kirkley Cliff Lowestoft NR32 5HF United Kingdom",52.46537548,1.743840873,"NR32 5HF","United Kingdom",,,Lowestoft,"SECOND & FOURTH Saturday (of the month) 0930hrs (onwards)",,,
https://www.afvbc.com/afvbc-uk-breakfast-clubs,"Ludlow Armed Forces & Veterans Breakfast Clubs","+44(0)7814564950 (Admin Telephone Number)",,https://www.afvbc.com/event/ludlow-armed-forces-veterans-breakfast-club,,,,,https://www.facebook.com/groups/LudlowAFVBC,,,,,,,,,,,,,"Bakers of Tower Street, Tower Street","Bakers of Tower Street Tower Street Ludlow SY8 1RL United Kingdom",52.36826292,-2.7168634,"SY8 1RL","United Kingdom",,,Ludlow,"EVERY Sunday 0930hrs (onwards)",,,
https://www.afvbc.com/afvbc-uk-breakfast-clubs,"Luton & District Armed Forces & Veterans Breakfast Clubs","+44(0)1582 865970",,https://www.afvbc.com/event/luton-district-armed-forces-veterans-breakfast-club,,,,,https://www.facebook.com/groups/LutonDistrictAFVBC,,,,,,,,,,,,,"The Chequers, East End, Houghton Regis","The Chequers East End Houghton Regis Dunstable LU5 4JN United Kingdom",51.90623738,-0.5139327049,"LU5 4JN","United Kingdom",,,Dunstable,"LAST Sunday (of the month) 0900hrs - 1100hrs",,,
https://www.afvbc.com/afvbc-uk-breakfast-clubs,"Lutterworth Armed Forces & Veterans Breakfast Clubs","+44(0)1455 552 486",,https://www.afvbc.com/event/lutterworth-armed-forces-veterans-breakfast-club,,,,,https://www.facebook.com/groups/151732622192749,,,,,,,,,,,,,"Wycliffe Rooms, George St","Wycliffe Rooms George St Lutterworth LE17 4ED United Kingdom",52.45734636,-1.200342178,"LE17 4ED","United Kingdom",,,Lutterworth,"SECOND Saturday (of the month) 1000hrs (onwards)",,,
https://www.afvbc.com/afvbc-uk-breakfast-clubs,"Lymington Armed Forces & Veterans Breakfast Clubs","+44(0)1590 670042",,https://www.afvbc.com/event/lymington-armed-forces-veterans-breakfast-club,,,,,https://www.facebook.com/groups/2070418589940635,,,,,,,,,,,,,"The Royal British Legion Club, Haig House, 22a High Street","The Royal British Legion Club Haig House 22a High Street Lymington SO41 9AD United Kingdom",50.75836524,-1.539872289,"SO41 9AD","United Kingdom",,,Lymington,"FIRST Saturday (of every month) 0930hrs (onwards)",,,
https://www.afvbc.com/afvbc-uk-breakfast-clubs,"Macclesfield Armed Forces & Veterans Breakfast Clubs","+44(0)1625 617886",,https://www.afvbc.com/event/macclesfield-armed-forces-veterans-breakfast-club,,,,,https://www.facebook.com/groups/2290623237710557/,,,,,,,,,,,,,"Macclesfield Masonic Hall, 1 Riseley Street","Macclesfield Masonic Hall 1 Riseley Street Macclesfield SK10 1BW United Kingdom",53.26211018,-2.134062052,"SK10 1BW","United Kingdom",,,Macclesfield,"SECOND Saturday (of the month) 0930hrs (onwards)",,,
https://www.afvbc.com/afvbc-uk-breakfast-clubs,"Maldon Armed Forces & Veterans Breakfast Clubs","+44(0)7928 307535",,https://www.afvbc.com/event/maldon-armed-forces-veterans-breakfast-club,,,,,https://www.facebook.com/groups/MaldonAFVBC/,,,,,,,,,,,,,"The Jolly Sailor, Basin Road, Heybridge Basin, Essex","The Jolly Sailor Basin Road Heybridge Basin Essex CM9 4RS United Kingdom",51.72957,0.7097178698,"CM9 4RS","United Kingdom",,,Maldon,"Visit Facebook Members Page to Confirm Dates/Times",,,
https://www.afvbc.com/afvbc-uk-breakfast-clubs,"Malvern Hills Armed Forces & Veterans Breakfast Clubs","+44(0)1684 580350",,https://www.afvbc.com/event/malvern-hills-armed-forces-veterans-breakfast-club,,,,,https://www.facebook.com/groups/,,,,,,,,,,,,,"The Foley Arms Hotel, 14 Worcester Rd","The Foley Arms Hotel 14 Worcester Rd Malvern WR14 4QS United Kingdom",52.11249474,-2.329992056,"WR14 4QS","United Kingdom",,,Malvern,"THIRD Saturday (of the month) 0930hrs (onwards)",,,
https://www.afvbc.com/afvbc-uk-breakfast-clubs,"Manchester Newton Heath Armed Forces & Veterans Breakfast Clubs",,,https://www.afvbc.com/event/manchester-newton-heath-armed-forces-veterans-breakfast-club,,,,,https://www.facebook.com/groups/383123778711429/,,,,,,,,,,,,,"Stirling Community Centre, Scotland Hall Road, Newton Heath","Stirling Community Centre Scotland Hall Road Newton Heath Manchester M40 2AZ United Kingdom",53.49329569,-2.180146426,"M40 2AZ","United Kingdom",,,Manchester,"EVERY Sunday 1030hrs - 1330hrs",,,
https://www.afvbc.com/afvbc-uk-breakfast-clubs,"Mansfield & Ashfield Armed Forces & Veterans Breakfast Clubs","+44(0)1623 623970",,https://www.afvbc.com/event/mansfield-ashfield-armed-forces-veterans-breakfast-club,,,,,https://www.facebook.com/groups/340651819601201,,,,,,,,,,,,,"The Bold Forester, Botany Avenue","The Bold Forester Botany Avenue Mansfield NG18 5NG United Kingdom",53.14101079,-1.210314631,"NG18 5NG","United Kingdom",,,Mansfield,"EVERY Saturday 1000hrs (onwards)",,,
https://www.afvbc.com/afvbc-uk-breakfast-clubs,"March Armed Forces & Veterans Breakfast Clubs","+44(0)1354 652309",,https://www.afvbc.com/event/march-armed-forces-veterans-breakfast-club,,,,,https://www.facebook.com/groups/2092949014145680,,,,,,,,,,,,,"Cassanos, 78-82 High Street","Cassanos 78-82 High Street March Cambridgeshire PE15 9LD United Kingdom",52.54658603,0.08742392063,"PE15 9LD","United Kingdom",,,March,"FIRST Saturday (of the month) 0930hrs (onwards)",,,
https://www.afvbc.com/afvbc-uk-breakfast-clubs,"Market Deeping Armed Forces & Veterans Breakfast Clubs","+44(0)1778 309929",,https://www.afvbc.com/event/market-deeping-armed-forces-veterans-breakfast-club,,,,,https://www.facebook.com/groups/afvbc.market.deeping/,,,,,,,,,,,,,"Iron Horse Ranch House, 2 High Street, Market Deeping, Lincolnshire","Iron Horse Ranch House 2 High Street Market Deeping Lincolnshire PE6 8EB United Kingdom",52.67485662,-0.3159923851,"PE6 8EB","United Kingdom",,,Peterborough,"SECOND Saturday (of the month) 0930hrs (onwards)",,,
https://www.afvbc.com/afvbc-uk-breakfast-clubs,"Market Harborough Armed Forces & Veterans Breakfast Clubs","+44(0)1858 463143",,https://www.afvbc.com/event/market-harborough-armed-forces-veterans-breakfast-club,,,,,,,,,,,,,,,,,,"The Royalist, 29 Western Avenue","The Royalist 29 Western Avenue Market Harborough LE16 9PL United Kingdom",52.47026937,-0.9260541201,"LE16 9PL","United Kingdom",,,"Market Harborough","THIRD Saturday (of every month) 0930hrs (onwards)",,,
