https://www.afvbc.com/afvbc-uk-breakfast-clubs,"Sheffield Armed Forces & Veterans Breakfast Clubs","+44(0)7591 422929 (ask for John)",,https://www.afvbc.com/event/sheffield-armed-forces-veterans-breakfast-club,,,,,https://www.facebook.com/groups/935886979803484/,,,,,,,,,,,,,"The Sheaf Island, Ward's Brewery, Ecclesall Rd","The Sheaf Island Ward's Brewery Ecclesall Rd Sheffield S11 8HW United Kingdom",53.37284422,-1.481988877,"S11 8HW","United Kingdom",,,Sheffield,"FIRST Saturday & THIRD Tuesday (of the month) 0930 (onwards)",,,
https://www.afvbc.com/afvbc-uk-breakfast-clubs,"Shefford Armed Forces & Veterans Breakfast Clubs","+44(0)1462 628448",,https://www.afvbc.com/event/shefford-armed-forces-veterans-breakfast-club,,,,,https://www.facebook.com/groups/1830711767072365,,,,,,,,,,,,,"The Brewery Tap, 14 Northbridge St","The Brewery Tap 14 Northbridge St Shefford SG17 5DH United Kingdom",52.03963654,-0.3343319893,"SG17 5DH","United Kingdom",,,Shefford,"FIRST Saturday (of the month) 1000hrs (onwards)",,,
https://www.afvbc.com/afvbc-uk-breakfast-clubs,"Shepton Mallet Armed Forces & Veterans Breakfast Clubs","+44(0)1749 343579",,https://www.afvbc.com/event/shepton-mallet-armed-forces-veterans-breakfast-club,,,,,https://www.facebook.com/sheptonmalletafvbc,,,,,,,,,,,,,"The Brasserie, 66 High Street","The Brasserie 66 High Street Shepton Mallet BA4 5AS United Kingdom",51.18856532,-2.5477467,"BA4 5AS","United Kingdom",,,"Shepton Mallet","FIRST Wednesday (of the month) 0930hrs (onwards)",,,
https://www.afvbc.com/afvbc-uk-breakfast-clubs,"Shipley Armed Forces & Veterans Breakfast Clubs","+44(0)1274 535290",,https://www.afvbc.com/event/shipley-armed-forces-veterans-breakfast-club,,,,,https://www.facebook.com/groups/2048191951910358/,,,,,,,,,,,,,"Sir Norman Rae (Wetherspoon), Market Square","Sir Norman Rae (Wetherspoon) Market Square Shipley BD18 3QB United Kingdom",53.83399877,-1.776942015,"BD18 3QB","United Kingdom",,,Shipley,"FIRST Sunday (of every month) 1030hrs (onwards)",,,
https://www.afvbc.com/afvbc-uk-breakfast-clubs,"Shirebrook Armed Forces & Veterans Breakfast Clubs","+44(0)1634 744371",,https://www.afvbc.com/event/shirebrook-armed-forces-veterans-breakfast-club,,,,,https://www.facebook.com/groups/391956494881733,,,,,,,,,,,,,"Shirebrook Christian Centre, 18-26 Main Street, Shirebrook","Shirebrook Christian Centre 18-26 Main Street Shirebrook Mansfield NG20 8DG United Kingdom",53.20241461,-1.216112618,"NG20 8DG","United Kingdom",,,Mansfield,"FIRST & THIRD Thursday & LAST Saturday (of the month) 1000hrs (onwards)",,,
https://www.afvbc.com/afvbc-uk-breakfast-clubs,"Shrewsbury Armed Forces & Veterans Breakfast Clubs",,,https://www.afvbc.com/event/shrewsbury-armed-forces-veterans-breakfast-club,,,,,https://www.facebook.com/groups/shrewsburyafvbc,,,,,,,,,,,,,,,52.71471426,-2.7496869,,"United Kingdom",,,,"FIRST & THIRD Sunday (of each month)",,,
https://www.afvbc.com/afvbc-uk-breakfast-clubs,"Sittingbourne Armed Forces & Veterans Breakfast Clubs","+44(0)1795 476791",,https://www.afvbc.com/event/sittingbourne-armed-forces-veterans-breakfast-club,,,,,https://www.facebook.com/groups/114060359420847/,,,,,,,,,,,,,"The Golden Hope, 1 Park Road","The Golden Hope 1 Park Road Sittingbourne Kent ME10 1DR United Kingdom",51.34042473,0.7321572304,"ME10 1DR","United Kingdom",,,Sittingbourne,"FOURTH Saturday (of the month) 1000hrs (onwards)",,,
https://www.afvbc.com/afvbc-uk-breakfast-clubs,"Skegness Armed Forces & Veterans Breakfast Clubs","+44(0)1754 610760",,https://www.afvbc.com/event/skegness-armed-forces-veterans-breakfast-club,,,,,https://www.facebook.com/groups/1493313967630635/,,,,,,,,,,,,,"The New Park Club, 31 Scarbrough Avenue","The New Park Club 31 Scarbrough Avenue Skegness PE25 2TQ United Kingdom",53.14586257,0.34184135,"PE25 2TQ","United Kingdom",,,Skegness,"EVERY OTHER Saturday Morning (VISIT FACEBOOK)",,,
https://www.afvbc.com/afvbc-uk-breakfast-clubs,"Skelmersdale Armed Forces & Veterans Breakfast Clubs","+44(0)1942 219740",,https://www.afvbc.com/event/skelmersdale-armed-forces-veterans-breakfast-club,,,,,https://www.facebook.com/groups/SkelmersdaleVBC,,,,,,,,,,,,,"The Mount Pub, 160 Orrell Road, Orrell","The Mount Pub 160 Orrell Road Orrell WN5 8HQ United Kingdom",53.5393574,-2.698463202,"WN5 8HQ","United Kingdom",,,Wigan,"LAST Saturday (of every month) 0900hrs - 1200hrs",,,
https://www.afvbc.com/afvbc-uk-breakfast-clubs,"Skelmersdale (Birchwood) Armed Forces & Veterans Breakfast Clubs","+44(0)7354 880824",,https://www.afvbc.com/event/skelmersdale-birchwood-armed-forces-veterans-breakfast-club,,,,,https://www.facebook.com/birchwood.skelmersdale,,,,,,,,,,,,,"West Lancs Diner, Witham Rd","West Lancs Diner Witham Rd Skelmersdale WN8 8HW United Kingdom",53.55080047,-2.80567646,"WN8 8HW","United Kingdom",,,Skelmersdale,"FIRST Saturday (of the month) 1000hrs - 1200hrs",,,
https://www.afvbc.com/afvbc-uk-breakfast-clubs,"Sleaford Armed Forces & Veterans Breakfast Clubs","+44(0)7787 430889",,https://www.afvbc.com/event/sleaford-armed-forces-veterans-breakfast-club,,,,,https://www.facebook.com/groups/343412332855827,,,,,,,,,,,,,"The Barge & Bottle, Carre Street","The Barge & Bottle Carre Street Sleaford NG34 7TW United Kingdom",52.99832743,-0.4080176353,"NG34 7TW","United Kingdom",,,Sleaford,"SECOND & FOURTH Saturday (of the month) 0945hrs (onwards)",,,
https://www.afvbc.com/afvbc-uk-breakfast-clubs,"South Leicestershire Armed Forces & Veterans Breakfast Clubs","+44(0)1162 771166",,https://www.afvbc.com/event/south-leicestershire-armed-forces-veterans-breakfast-club,,,,,https://www.facebook.com/groups/631900726966975/,,,,,,,,,,,,,"Fox and Tiger, 4 Lutterworth Road, Blaby","Fox and Tiger 4 Lutterworth Road Blaby LE8 4DN United Kingdom",52.57558427,-1.16323065,"LE8 4DN","United Kingdom",,,Leicester,"LAST Saturday (of every month) 1000hrs (onwards)",,,
https://www.afvbc.com/afvbc-uk-breakfast-clubs,"South Normanton Armed Forces & Veterans Breakfast Clubs","+44(0)1773 860296",,https://www.afvbc.com/event/south-normanton-armed-forces-veterans-breakfast-club,,,,,https://www.facebook.com/groups/894816257568712/,,,,,,,,,,,,,"The Post Mill Centre, Off Market St, South Normanton","The Post Mill Centre Off Market St South Normanton Alfreton DE55 2EJ United Kingdom",53.10584479,-1.341319084,"DE55 2EJ","United Kingdom",,,Alfreton,"EVERY Friday & FIRST Saturday (of the month) 0930hrs (onwards)",,,
https://www.afvbc.com/afvbc-uk-breakfast-clubs,"South Shields Armed Forces & Veterans Breakfast Clubs","+44(0)191 536 4198",,https://www.afvbc.com/event/south-shields-armed-forces-veterans-breakfast-club,,,,,https://www.facebook.com/groups/afvbc.south.shields/,,,,,,,,,,,,,"The Britannia Toby Carvery, Front Street, Cleadon, South Shields, Tyne And Wear","The Britannia Toby Carvery Front Street Cleadon South Shields, Tyne And Wear SR6 7PG United Kingdom",54.95450277,-1.4014045,"SR6 7PG","United Kingdom",,,Sunderland,"FIRST & THIRD Saturday (of the month) 0930hrs (onwards)",,,
https://www.afvbc.com/afvbc-uk-breakfast-clubs,"Southam Armed Forces & Veterans Breakfast Clubs","+44(001926 812185",,https://www.afvbc.com/event/southam-armed-forces-veterans-breakfast-club,,,,,https://www.facebook.com/groups/afvbc.southam/,,,,,,,,,,,,,"The Community Hub & Cafe, Banbury Road","The Community Hub & Cafe Banbury Road Southam Warwickshire CV47 2BL United Kingdom",52.24629152,-1.389301121,"CV47 2BL","United Kingdom",,,Southam,"LAST Wednesday & LAST Saturday (of the month) 0930hrs (onwards)",,,
https://www.afvbc.com/afvbc-uk-breakfast-clubs,"Southampton (Central) Armed Forces & Veterans Breakfast Clubs","+44(0)7788 371909",,https://www.afvbc.com/event/armed-forces-veterans-breakfast-club-southampton-veterans-centre,,,,,,,,,,,,,,,,,,"The Veterans Centre, Woodley Road, Woolston","The Veterans Centre Woodley Road Woolston SO19 9DW United Kingdom",50.89743957,-1.3805338,"SO19 9DW","United Kingdom",,,Southampton,"EVERY Tuesday, Thursday and Saturday",,,
https://www.afvbc.com/afvbc-uk-breakfast-clubs,"Southampton (East) Armed Forces & Veterans Breakfast Clubs","+44(0)7527 090031",,https://www.afvbc.com/event/southampton-armed-forces-veterans-breakfast-club,,,,,https://www.facebook.com/groups/southamptonafvbc,,,,,,,,,,,,,"The Master Builder, 189 Swaythling Road, West End","The Master Builder 189 Swaythling Road West End Southampton SO30 3AH United Kingdom",50.93023764,-1.345524788,"SO30 3AH","United Kingdom",,,Southampton,"EVERY Friday 1000hrs - 1200hrs",,,
https://www.afvbc.com/afvbc-uk-breakfast-clubs,"Southampton (West) Armed Forces & Veterans Breakfast Clubs","+44(0)2380 742301",,https://www.afvbc.com/event/southampton-west-armed-forces-veterans-breakfast-club,,,,,https://www.facebook.com/groups/659596662103066/,,,,,,,,,,,,,"Manston Court, Lordshill","Manston Court Lordshill Southampton Hampshire SO16 8TH United Kingdom",50.93944882,-1.4484603,"SO16 8TH","United Kingdom",,,Southampton,"FIRST Sunday day (of the month) 1000hrs (onwards)",,,
https://www.afvbc.com/afvbc-uk-breakfast-clubs,"Southend-on-Sea Armed Forces & Veterans Breakfast Clubs","+44(0)1702 588645",,https://www.afvbc.com/event/southend-on-sea-armed-forces-veterans-breakfast-club,,,,,https://www.facebook.com/groups/1457975904505031,,,,,,,,,,,,,"Halfway House (Toby Carvery), 213 Eastern Esplanade, Thorpe Bay","Halfway House (Toby Carvery) 213 Eastern Esplanade Thorpe Bay Southend-on-Sea, Essex SS1 3AD United Kingdom",51.53045944,0.7445168495,"SS1 3AD","United Kingdom",,,Southend-on-Sea,"EVERY Saturday (of every month) 0930hrs (onwards)",,,
https://www.afvbc.com/afvbc-uk-breakfast-clubs,"Southport Armed Forces & Veterans Breakfast Clubs","+44(0)1704 504675 (Venue Contact Number)",,https://www.afvbc.com/event/southport-armed-forces-veterans-breakfast-club,,,,,https://www.facebook.com/groups/627537838018817,,,,,,,,,,,,,"Ocean Plaza Brewers Fayre, Marine Drive, Ainsdale","Ocean Plaza Brewers Fayre Marine Drive Ainsdale Southport PR8 1RY United Kingdom",53.65094008,-3.014566898,"PR8 1RY","United Kingdom",,,Southport,"FIRST Saturday (of the month) 0900hrs (onwards)",,,
https://www.afvbc.com/afvbc-uk-breakfast-clubs,"St Andrews Armed Forces & Veterans Breakfast Clubs","+44(0))1334 472013",,https://www.afvbc.com/event/st-andrews-armed-forces-veterans-breakfast-club,,,,,https://www.facebook.com/groups/1977317855817976/,,,,,,,,,,,,,"Craigtoun CafÃ©, Craigtoun Country Park","Craigtoun CafÃ© Craigtoun Country Park St Andrews Fife KY16 8NX United Kingdom",56.31781601,-2.838206291,"KY16 8NX","United Kingdom",,,"St Andrews","EVERY Sunday 1000hrs (onwards)",,,
https://www.afvbc.com/afvbc-uk-breakfast-clubs,"St Austell Armed Forces & Veterans Breakfast Clubs","+44(0)1726 879604",,https://www.afvbc.com/event/st-austell-armed-forces-veterans-breakfast-club,,,,,https://www.facebook.com/groups/824326334698436/,,,,,,,,,,,,,"Mount Charles Social Club, Clifden Road","Mount Charles Social Club Clifden Road Saint Austell PL25 4NX United Kingdom",50.33934593,-4.772626162,"PL25 4NX","United Kingdom",,,"Saint Austell","SECOND Saturday (of the month) 1000hrs (onwards)",,,
https://www.afvbc.com/afvbc-uk-breakfast-clubs,"St Helens Armed Forces & Veterans Breakfast Clubs","+44(0)7391 573003",,https://www.afvbc.com/event/st-helens-armed-forces-veterans-breakfast-club,,,,,https://www.facebook.com/groups/469445103238464/,,,,,,,,,,,,,"Red V Cafe Bar, Totally Wicked Stadium, McManus Drive, St Helens","Red V Cafe Bar Totally Wicked Stadium McManus Drive St Helens WA9 3AL United Kingdom",53.44685801,-2.725896835,"WA9 3AL","United Kingdom",,,"Saint Helens","EVERY Thursday 0900hrs - 1300hrs",,,
https://www.afvbc.com/afvbc-uk-breakfast-clubs,"St Neots & District Armed Forces & Veterans Breakfast Clubs","+44(0)777 59910980",,https://www.afvbc.com/event/st-neots-district-armed-forces-veterans-breakfast-club,,,,,https://www.facebook.com/groups/470259047213175,,,,,,,,,,,,,"George & Dragon, 267 Great North Road, Eaton Socon, St Neots, Cambs","George & Dragon 267 Great North Road Eaton Socon St Neots, Cambs PE19 8BL United Kingdom",52.22139816,-0.288079977,"PE19 8BL","United Kingdom",,,"Saint Neots","FIRST Sunday (of the month) 1000hrs (onwards)",,,
https://www.afvbc.com/afvbc-uk-breakfast-clubs,"St. Ives & Huntingdonshire Armed Forces & Veterans Breakfast Clubs","+44(0)1480 301519",,https://www.afvbc.com/event/st-ives-armed-forces-veterans-breakfast-club,,,,,https://www.facebook.com/groups/719310914866371,,,,,,,,,,,,,"The Haywain, Constable Road, St Ives","The Haywain Constable Road St Ives PE27 3EP United Kingdom",52.34329702,-0.07514476776,"PE27 3EP","United Kingdom",,,"St. Ives","FIRST & FOURTH Saturday (of the month) 0900hrs (onwards)",,,
https://www.afvbc.com/afvbc-uk-breakfast-clubs,"Stafford Armed Forces & Veterans Breakfast Clubs","+44(0)1785 785620",,https://www.afvbc.com/event/stafford-armed-forces-veterans-breakfast-club,,,,,https://www.facebook.com/groups/1389944131110772/,,,,,,,,,,,,,"Redhill Brewers Fayre, 1 Spitfire Close","Redhill Brewers Fayre 1 Spitfire Close Stafford Staffordshire ST16 1GX United Kingdom",52.83181651,-2.134974003,"ST16 1GX","United Kingdom",,,Stafford,"THIRD Saturday (of the month) 0900hrs (onwards)",,,
https://www.afvbc.com/afvbc-uk-breakfast-clubs,"Stamford Armed Forces & Veterans Breakfast Clubs","+44(0)1780 754919",,https://www.afvbc.com/event/stamford-armed-forces-veterans-breakfast-club,,,,,https://www.facebook.com/groups/stamford.afvbc/,,,,,,,,,,,,,"The London Inn, 4 St John's Street","The London Inn 4 St John's Street Stamford PE9 2DB United Kingdom",52.65138083,-0.4803192616,"PE9 2DB","United Kingdom",,,Stamford,"FIRST Saturday (of the month) 0930hrs (onwards)",,,
https://www.afvbc.com/afvbc-uk-breakfast-clubs,"Standford Hill (HMP) Armed Forces & Veterans Breakfast Clubs",,,https://www.afvbc.com/event/hmp-standford-hill-armed-forces-veterans-breakfast-club,,,,,https://www.facebook.com/groups/afvbc.hmp.standford.hill/,,,,,,,,,,,,,"HMP Standford Hill (Visitors Centre), Church Road, Eastchurch","HMP Standford Hill (Visitors Centre) Church Road Eastchurch Sheerness ME12 4AA United Kingdom",51.39502865,0.8510515094,"ME12 4AA","United Kingdom",,,Sheerness,"DATES VARY (of the month) 0930hrs - 1100hrs",,,
https://www.afvbc.com/afvbc-uk-breakfast-clubs,"Stapleford Armed Forces & Veterans Breakfast Clubs","+44(0)7482 295356",,https://www.afvbc.com/event/stapleford-armed-forces-veterans-breakfast-club,,,,,https://www.facebook.com/groups/651955269417291/,,,,,,,,,,,,,"Two for Tea, 92 Derby Road, Stapleford","Two for Tea 92 Derby Road Stapleford Nottingham NG9 7AD United Kingdom",52.92774862,-1.278638542,"NG9 7AD","United Kingdom",,,Nottingham,"SECOND Saturday (of the month) 1000hrs (onwards)",,,
https://www.afvbc.com/afvbc-uk-breakfast-clubs,"Stocken (HMP) Armed Forces & Veterans Breakfast Clubs","+44(0)1780 795100",,https://www.afvbc.com/event/stocken-armed-forces-veterans-breakfast-club,,,,,https://www.facebook.com/groups/afvbc.hmp.stocken/,,,,,,,,,,,,,"HMP Stocken, Stocken Hall Road, Stretton, Rutland","HMP Stocken Stocken Hall Road Stretton Rutland LE15 7RD United Kingdom",52.74702846,-0.5822069943,"LE15 7RD","United Kingdom",,,Oakham,"FIRST Tuesday (of the month) 0900hrs (onwards)",,,
https://www.afvbc.com/afvbc-uk-breakfast-clubs,"Stoke Armed Forces & Veterans Breakfast Clubs","+44(0)7557 303797",,https://www.afvbc.com/event/stoke-armed-forces-veterans-breakfast-club,,,,,https://www.facebook.com/groups/1500925490186173/,,,,,,,,,,,,,"The Green Star, Esperanto Way, Smallthorne","The Green Star Esperanto Way Smallthorne Stoke-on-Trent ST6 1SF United Kingdom",53.04657316,-2.173844576,"ST6 1SF","United Kingdom",,,Stoke-on-Trent,"FIRST Sunday (of the month) 1000hrs (onwards)",,,
https://www.afvbc.com/afvbc-uk-breakfast-clubs,"Stoke (South) Armed Forces & Veterans Breakfast Clubs","+44(0)1782 324398",,https://www.afvbc.com/event/stoke-south-armed-forces-veterans-breakfast-club,,,,,https://www.facebook.com/groups/1812601492195200/,,,,,,,,,,,,,"The Landau Centre, Waterside Drive, Newstead","The Landau Centre Waterside Drive Newstead Stoke-on-Trent ST3 3NW United Kingdom",52.96767797,-2.160208225,"ST3 3NW","United Kingdom",,,Stoke-on-Trent,"SECOND Saturday (of every month) 0900hrs (onwards)",,,
https://www.afvbc.com/afvbc-uk-breakfast-clubs,"Stoke Mandeville Hospital Armed Forces & Veterans Breakfast Clubs","+44 (0)1296 315000",,https://www.afvbc.com/event/%5Bnode%3Atitle%5D-armed-forces-veterans-breakfast-club,,,,,https://www.facebook.com/groups/afvbc.stoke.mandeville.hospital/,,,,,,,,,,,,,"Stoke Mandeville Hospital Main Restaurant, Mandeville Road","Stoke Mandeville Hospital Main Restaurant Mandeville Road Aylesbury HP21 8AL United Kingdom",51.79849416,-0.8025866747,"HP21 8AL","United Kingdom",,,Aylesbury,"EVERY Sunday 0900hrs (onwards)",,,
https://www.afvbc.com/afvbc-uk-breakfast-clubs,"Stowmarket Armed Forces & Veterans Breakfast Clubs","+44(0)1449 773376",,https://www.afvbc.com/event/stowmarket-armed-forces-veterans-breakfast-club,,,,,https://www.facebook.com/groups/296544084578743,,,,,,,,,,,,,"Stowmarket Meadlands Recreation Club, 93 Needham Road","Stowmarket Meadlands Recreation Club 93 Needham Road Stowmarket IP14 2AD United Kingdom",52.17936614,1.007341146,"IP14 2AD","United Kingdom",,,Stowmarket,"FIRST Sunday (of every month) 0900hrs (onwards)",,,
https://www.afvbc.com/afvbc-uk-breakfast-clubs,"Stranraer Armed Forces & Veterans Breakfast Clubs","+44(0)1776 705645",,https://www.afvbc.com/event/stranraer-armed-forces-veterans-breakfast-club,,,,,https://www.facebook.com/groups/2148651625350114,,,,,,,,,,,,,"Rustique Cafe/Restaurant, Commerce Road","Rustique Cafe/Restaurant Commerce Road Stranraer DG9 7DD United Kingdom",54.89586017,-5.020501167,"DG9 7DD","United Kingdom",,,Stranraer,"EVERY Saturday 1000hrs (onwards)",,,
https://www.afvbc.com/afvbc-uk-breakfast-clubs,"Stratford-upon-Avon Armed Forces & Veterans Breakfast Clubs","+44(0)1789 761982",,https://www.afvbc.com/event/stratford-upon-avon-armed-forces-veterans-breakfast-club,,,,,https://www.facebook.com/groups/3176630385740257/,,,,,,,,,,,,,"Stratford Oaks Golf Club, Bearley Road, Snitterfield","Stratford Oaks Golf Club Bearley Road Snitterfield Stratford-upon-Avon, Warwickshire CV37 0EZ United Kingdom",52.24192297,-1.717574,"CV37 0EZ","United Kingdom",,,Stratford-upon-Avon,"EVERY Monday & THIRD Saturday 1000hrs (onwards)",,,
https://www.afvbc.com/afvbc-uk-breakfast-clubs,"Sudbury Armed Forces & Veterans Breakfast Clubs","+44(0)1787 371285",,https://www.afvbc.com/event/sudbury-armed-forces-veterans-breakfast-club,,,,,,,,,,,,,,,,,,"The George & Dragon, Hall Street, Long Melford","The George & Dragon Hall Street Long Melford Sudbury, Suffolk CO10 9JA United Kingdom",52.07581591,0.7167506218,"CO10 9JA","United Kingdom",,,Sudbury,"EVERY Saturday 1100hrs (onwards)",,,
https://www.afvbc.com/afvbc-uk-breakfast-clubs,"Sunderland Armed Forces & Veterans Breakfast Clubs","+44(0)7999 353 498",,https://www.afvbc.com/event/sunderland-armed-forces-veterans-breakfast-club,,,,,https://www.facebook.com/groups/1395027827192101/,,,,,,,,,,,,,"Lakeside Community Centre, North Moor Lane","Lakeside Community Centre North Moor Lane Sunderland SR3 3BD United Kingdom",54.87785661,-1.418307871,"SR3 3BD","United Kingdom",,,Sunderland,"FIRST & THIRD Saturday (of every month) 0900hrs (onwards, last B/Fast order 1030hrs))",,,
https://www.afvbc.com/afvbc-uk-breakfast-clubs,"Sunderland (AFC) Armed Forces & Veterans Breakfast Clubs","+44(0)3719 111200",,https://www.afvbc.com/event/sunderland-afc-armed-forces-veterans-breakfast-club,,,,,https://www.facebook.com/groups/sunderland.afc.afvbc/,,,,,,,,,,,,,"Sunderland Association Football Club, The Black Cats Bar, Stadium Of Light","Sunderland Association Football Club The Black Cats Bar Stadium Of Light Sunderland SR5 1SU",54.91541591,-1.388414651,"SR5 1SU","United Kingdom",,,Sunderland,"SECOND Wednesday (of the month) 0900hrs (onwards)",,,
https://www.afvbc.com/afvbc-uk-breakfast-clubs,"Swadlincote Armed Forces & Veterans Breakfast Clubs","+44(0)1283 550943",,https://www.afvbc.com/event/swadlincote-armed-forces-veterans-breakfast-club,,,,,https://www.facebook.com/groups/960889453951085/,,,,,,,,,,,,,"The Tall Chimney (Hungry Horse), Unit 20, The Pipe Works, Coppice Side","The Tall Chimney (Hungry Horse) Unit 20, The Pipe Works Coppice Side Swadlincote DE11 9FQ United Kingdom",52.7714914,-1.555061638,"DE11 9FQ","United Kingdom",,,Swadlincote,"THIRD Saturday (of the month) 0930hrs (onwards)",,,
https://www.afvbc.com/afvbc-uk-breakfast-clubs,"Swaffham Armed Forces & Veterans Breakfast Clubs","+44(0)1760 724295",,https://www.afvbc.com/event/swaffham-armed-forces-veterans-breakfast-club,,,,,https://www.facebook.com/groups/swaffham.afvbc/,,,,,,,,,,,,,"The White Hart, 2 London St","The White Hart 2 London St Swaffham PE37 7NP United Kingdom",52.64687733,0.6881716847,"PE37 7NP","United Kingdom",,,Swaffham,"LAST Saturday (of the month) 1000hrs (onwards)",,,
https://www.afvbc.com/afvbc-uk-breakfast-clubs,"Swansea Armed Forces & Veterans Breakfast Clubs","+44(0)1792 311920",,https://www.afvbc.com/event/swansea-armed-forces-veterans-breakfast-club,,,,,https://www.facebook.com/groups/1525214847778897,,,,,,,,,,,,,"Swansea Vale Brewers Fayre, Upper Fforest Way, Morriston, Llansamlet","Swansea Vale Brewers Fayre Upper Fforest Way Morriston Llansamlet, Swansea SA6 8WB United Kingdom",51.66524315,-3.912109137,"SA6 8WB","United Kingdom",,,Swansea,"FIRST Saturday & THIRD Sunday (of the month) 0900hrs (onwards)",,,
https://www.afvbc.com/afvbc-uk-breakfast-clubs,"Swindon Armed Forces & Veterans Breakfast Clubs",+44(0)1793702081,,https://www.afvbc.com/event/swindon-armed-forces-veterans-breakfast-club,,,,,https://www.facebook.com/groups/1567531576795065/,,,,,,,,,,,,,"The Friary (Toby Carvery), Abbey Meads Village Centre","The Friary (Toby Carvery) Abbey Meads Village Centre Swindon SN25 4YX United Kingdom",51.59869061,-1.80180341,"SN25 4YX","United Kingdom",,,Swindon,"EVERY Saturday 0915hrs (onwards)",,,
https://www.afvbc.com/afvbc-uk-breakfast-clubs,"Syston & District Armed Forces & Veterans Breakfast Clubs","+44(0)116 319 6050",,https://www.afvbc.com/event/syston-district-armed-forces-veterans-breakfast-club,,,,,https://www.facebook.com/groups/1582141908507304,,,,,,,,,,,,,"The Brook Cafe, 8 Brookside, Syston","The Brook Cafe 8 Brookside Syston Leicester LE7 1GG United Kingdom",52.69854442,-1.075738699,"LE7 1GG","United Kingdom",,,Leicester,"THIRD Monday (of the month) 0900hrs (onwards)",,,
https://www.afvbc.com/afvbc-uk-breakfast-clubs,"Taff Ely Armed Forces & Veterans Breakfast Clubs","+44(0)7913 355911",,https://www.afvbc.com/event/taff-ely-veterans-breakfast-group,,,,,https://www.facebook.com/TaffElyVeteranGroup,,,,,,,,,,,,,"Rhydyfelin Community Centre, Dyffryn Rd, Rhydyfelin","Rhydyfelin Community Centre Dyffryn Rd Rhydyfelin Pontypridd CF37 5RW United Kingdom",51.5871731,-3.313115537,"CF37 5RW","United Kingdom",,,Pontypridd,,,,
https://www.afvbc.com/afvbc-uk-breakfast-clubs,"Tameside Armed Forces & Veterans Breakfast Clubs","+44(0)161 339 3933",,https://www.afvbc.com/event/tameside-armed-forces-veterans-breakfast-club,,,,,https://www.facebook.com/groups/tamesideafvbc/,,,,,,,,,,,,,"Globe Cafe, Headway House, Globe Lane","Globe Cafe Headway House Globe Lane Dukinfield SK16 4RG United Kingdom",53.47221136,-2.101843357,"SK16 4RG","United Kingdom",,,Dukinfield,"SECOND Saturday (of the month) 1000hrs (onwards)",,,
https://www.afvbc.com/afvbc-uk-breakfast-clubs,"Tamworth Armed Forces & Veterans Breakfast Clubs","+44(0)1827 62598",,https://www.afvbc.com/event/tamworth-armed-forces-veterans-breakfast-club,,,,,https://www.facebook.com/groups/tamworth.afvbc/,,,,,,,,,,,,,"The Old Crown, 120 Main Road, Wigginton","The Old Crown 120 Main Road Wigginton Tamworth B79 9DW United Kingdom",52.65698048,-1.692286134,"B79 9DW","United Kingdom",,,Tamworth,"SECOND Saturday (of the month) 1000hrs (onwards)",,,
https://www.afvbc.com/afvbc-uk-breakfast-clubs,"Tanygrisiau (Blaenau Ffestiniog) Armed Forces & Veterans Breakfast Clubs","+44(0)1766 830950",,https://www.afvbc.com/event/tanygrisiau-blaenau-ffestinio-armed-forces-veterans-breakfast-club,,,,,https://www.facebook.com/groups/150185702379385/,,,,,,,,,,,,,"Lakeside Cafe, Power Station, A496","Lakeside Cafe Power Station A496 Blaenau Ffestiniog LL41 3TP United Kingdom",52.98553497,-3.965190053,"LL41 3TP","United Kingdom",,,"Blaenau Ffestiniog","SECOND Saturday (of the month) 1000hrs (onwards)",,,
https://www.afvbc.com/afvbc-uk-breakfast-clubs,"Taunton Armed Forces & Veterans Breakfast Clubs","+44(0)1823 217117",,https://www.afvbc.com/event/taunton-armed-forces-veterans-breakfast-club,,,,,https://www.facebook.com/groups/TauntonVetsBreakfastClub/,,,,,,,,,,,,,"The Vivary Park Golf Club, Mount Street","The Vivary Park Golf Club Mount Street Taunton TA1 3QE United Kingdom",51.00747179,-3.101686388,"TA1 3QE","United Kingdom",,,Taunton,"FIRST Sunday (of every month) 0900hrs (onwards)",,,
https://www.afvbc.com/afvbc-uk-breakfast-clubs,"Teesdale Armed Forces & Veterans Breakfast Clubs",,,https://www.afvbc.com/event/teesdale-armed-forces-veterans-breakfast-club,,,,,https://www.facebook.com/groups/afvbc.teesdale/,,,,,,,,,,,,,"The Masonic Hall, Staindrop","The Masonic Hall Staindrop Darlington DL2 3LD United Kingdom",54.57974824,-1.808469641,"DL2 3LD","United Kingdom",,,Darlington,"SECOND Saturday (of the month) 0900hrs (onwards)",,,
https://www.afvbc.com/afvbc-uk-breakfast-clubs,"Telford Armed Forces & Veterans Breakfast Clubs","+44(0)1952 567506",,https://www.afvbc.com/event/telford-armed-forces-veterans-breakfast-club,,,,,https://www.facebook.com/groups/752984334911792,,,,,,,,,,,,,"The Outpost Cafe & Bar, The Wakes, Theatre Square","The Outpost Cafe & Bar The Wakes Theatre Square Telford TF2 6EP United Kingdom",52.69544509,-2.451399565,"TF2 6EP","United Kingdom",,,Telford,"THIRD & FOURTH Saturday (of the month) 0900hrs (onwards)",,,
