Source,Name,"Main Phone","Main Email",Website,"Website Valid","Email extension",Linkedin,Instagram,Facebook,X,Pinterest,TikTok,Youtube,Mission,"Veteran Owned Business Y/N","Is certified Veteran Owned Business Y/N","Is Veteran Service Organization Y/N","Is VA or GOV Organization Y/N","VA or GOV Type","VA or GOV Subtype","Service Area","Address Line one","Address Line Two",Latitude,Longitude,"Zip Code",Country,State,County,"Municipality - Place",Notes,Owner,"Owner Phone","Owner Email"
https://www.afvbc.com/afvbc-uk-breakfast-clubs,"Aberdeen Armed Forces & Veterans Breakfast Clubs","+44(0)224 249924",,https://www.afvbc.com/event/aberdeen-armed-forces-veterans-breakfast-club,,,,,https://www.facebook.com/groups/454171848087902,,,,,,,,,,,,,"Ghillies Lair, The Great Southern Road, Bridge of Dee","Ghillies Lair The Great Southern Road Bridge of Dee AB12 5XA United Kingdom",57.12298623,-2.11702466,"AB12 5XA","United Kingdom",,,Aberdeen,"FIRST Saturday (of the month) 1000hrs (onwards)",,,
https://www.afvbc.com/afvbc-uk-breakfast-clubs,"Addington Armed Forces Veterans Breakfast Club","+44(0)7958 337213",,https://www.afvbc.com/event/addington-armed-forces-veterans-breakfast-club,,,,,https://www.facebook.com/groups/247747835731217,,,,,,,,,,,,,"The Cricketers, 36 Addington Village Road, Addington","The Cricketers 36 Addington Village Road Addington Croydon CR0 5AQ United Kingdom",51.35780029,-0.03298044205,"CR0 5AQ","United Kingdom",,,Croydon,"THIRD Saturday (of the month) 0930hrs (onwards)",,,
https://www.afvbc.com/afvbc-uk-breakfast-clubs,"Aldershot Armed Forces & Veterans Breakfast Clubs","+44(0)1252 361770",,https://www.afvbc.com/event/aldershot-armed-forces-veterans-breakfast-club,,,,,https://www.facebook.com/groups/1084470288260123/,,,,,,,,,,,,,"JD Weatherspoons, Queen Hotel, 1 High Street","JD Weatherspoons Queen Hotel 1 High Street Aldershot, Hants GU11 1BH United Kingdom",51.24975397,-0.76759895,"GU11 1BH","United Kingdom",,,Aldershot,"FIRST & THIRD Saturday (of the month) 0930hrs (onwards)",,,
https://www.afvbc.com/afvbc-uk-breakfast-clubs,"Allenton Armed Forces & Veterans Breakfast Clubs","+44(0)1332 386241",,https://www.afvbc.com/event/allenton-armed-forces-veterans-breakfast-club,,,,,https://www.facebook.com/groups/2005804666132631,,,,,,,,,,,,,"The Merlin, 1 Orient Way, Pride Parkway","The Merlin 1 Orient Way Pride Parkway Derby DE24 8XL United Kingdom",52.91132838,-1.450763941,"DE24 8XL","United Kingdom",,,Derby,"EVERY Saturday 0930hrs (onwards)",,,
https://www.afvbc.com/afvbc-uk-breakfast-clubs,"Alloa (Scotland) Armed Forces & Veterans Breakfast Clubs","+44(0)1259 222590",,https://www.afvbc.com/event/alloa-armed-forces-veterans-breakfast-club,,,,,https://www.facebook.com/groups/1958636194410517,,,,,,,,,,,,,"The Bobbing John, 46 Drysdale Street","The Bobbing John 46 Drysdale Street Alloa FK10 1JL United Kingdom",56.11600044,-3.791345358,"FK10 1JL","United Kingdom",,,Alloa,"THIRD Saturday (of the month) 0900hrs (onwards)",,,
https://www.afvbc.com/afvbc-uk-breakfast-clubs,"Alresford Armed Forces & Veterans Breakfast Clubs","+44(0)7920 427776",,https://www.afvbc.com/event/alresford-armed-forces-veterans-breakfast-club,,,,,https://www.facebook.com/groups/alresfordafvbc,,,,,,,,,,,,,"Arlebury Cafe, Arlebury Park, The Avenue, New Alresford","Arlebury Cafe Arlebury Park The Avenue New Alresford SO24 9EP United Kingdom",51.08945693,-1.17230985,"SO24 9EP","United Kingdom",,,Alresford,"SECOND Saturday (of every month) 0930hrs - 1130hrs",,,
https://www.afvbc.com/afvbc-uk-breakfast-clubs,"Andover Armed Forces & Veterans Breakfast Clubs","+44(0)1264 369345",,https://www.afvbc.com/event/andover-armed-forces-veterans-breakfast-club,,,,,https://www.facebook.com/groups/afvbc.andover/,,,,,,,,,,,,,"Too Fast Too Filling, Commercial Centre, Picket Piece","Too Fast Too Filling Commercial Centre Picket Piece Andover SP11 6RU United Kingdom",51.22343855,-1.440949738,"SP11 6RU","United Kingdom",,,Andover,"THIRD Saturday (of the month) 0930hrs (onwards)",,,
https://www.afvbc.com/afvbc-uk-breakfast-clubs,"Annandale Armed Forces & Veterans Breakfast Clubs","+44(0)1461 204108",,https://www.afvbc.com/event/annandale-armed-forces-veterans-breakfast-club,,,,,https://www.facebook.com/groups/afvbc.annandale,,,,,,,,,,,,,"Annan Athletic Football Club, Galabank, North Street","Annan Athletic Football Club Galabank North Street Annan DG12 5DQ United Kingdom",54.99414861,-3.261544704,"DG12 5DQ","United Kingdom",,,Annan,"THIRD Saturday (of the month) 1100hrs (onwards)",,,
https://www.afvbc.com/afvbc-uk-breakfast-clubs,"Antrim Armed Forces & Veterans Breakfast Clubs",,,https://www.afvbc.com/event/antrim-armed-forces-veterans-breakfast-club,,,,,https://www.facebook.com/groups/antrim.afvbc/,,,,,,,,,,,,,"The Antrim Masonic Hall, 68-70 Church Street","The Antrim Masonic Hall 68-70 Church Street Antrim Northern Ireland BT41 4BA United Kingdom",54.71353795,-6.214621961,"BT41 4BA","United Kingdom",,,Antrim,"FIRST Saturday (of the month) 1000hrs (onwards)",,,
https://www.afvbc.com/afvbc-uk-breakfast-clubs,"Arbroath Armed Forces & Veterans Breakfast Clubs","+44(0)1241 434143",,https://www.afvbc.com/event/arbroath-armed-forces-veterans-breakfast-club,,,,,https://www.facebook.com/groups/1082061528577017,,,,,,,,,,,,,"The Anchor Bar, 18 West Port","The Anchor Bar 18 West Port Arbroath DD11 1RE United Kingdom",56.55813717,-2.58792055,"DD11 1RE","United Kingdom",,,Arbroath,"FIRST & THIRD Saturday (of the month) 0930hrs (onwards)",,,
https://www.afvbc.com/afvbc-uk-breakfast-clubs,"Ashby-de-la-zouch Armed Forces & Veterans Breakfast Clubs","+44(0)1530 414531",,https://www.afvbc.com/event/ashby-de-la-zouch-armed-forces-veterans-breakfast-club,,,,,https://www.facebook.com/groups/afvbc.ashby.de.la.zouch,,,,,,,,,,,,,"The White Hart, Market Street, Ashby-De-La-Zouch, Leicestershire","The White Hart Market Street Ashby-De-La-Zouch Leicestershire LE65 1AP",52.74752204,-1.469646692,"LE65 1AP","United Kingdom",,,Ashby-de-la-Zouch,"FOURTH Saturday (of the month) 0900hrs (onwards)",,,
https://www.afvbc.com/afvbc-uk-breakfast-clubs,"Ashford (Kent) Armed Forces & Veterans Breakfast Clubs","+44(0)1233 646891",,https://www.afvbc.com/event/ashford-armed-forces-veterans-breakfast-club,,,,,https://www.facebook.com/groups/452863854918797/,,,,,,,,,,,,,"County Hotel (Wetherspoons), 10 High Street","County Hotel (Wetherspoons) 10 High Street Ashford Kent TN24 8TD United Kingdom",51.14904028,0.8751404285,"TN24 8TD","United Kingdom",,,Ashford,"LAST Saturday (of the month) 0900hrs (onwards)",,,
https://www.afvbc.com/afvbc-uk-breakfast-clubs,"Ashford (North) Armed Forces & Veterans Breakfast Clubs","+44(0)1233 663634",,https://www.afvbc.com/event/ashford-north-armed-forces-veterans-breakfast-club,,,,,https://www.facebook.com/groups/530732690757558/,,,,,,,,,,,,,"The Bybrook Barn Harvester, Canterbury Road, Kennington","The Bybrook Barn Harvester Canterbury Road Kennington Ashford TN24 8QQ United Kingdom",51.15790221,0.8796022832,"TN24 8QQ","United Kingdom",,,Ashford,"FIRST Saturday (of the month) 0930hrs (onwards)",,,
https://www.afvbc.com/afvbc-uk-breakfast-clubs,"Aylesbury Armed Forces & Veterans Breakfast Clubs","+44(0)1296 468440",,https://www.afvbc.com/event/aylesbury-armed-forces-veterans-breakfast-club,,,,,https://www.facebook.com/groups/1655056491416455,,,,,,,,,,,,,"The White Hart, Exchange Street","The White Hart Exchange Street Aylesbury HP20 1UR United Kingdom",51.81556992,-0.80943755,"HP20 1UR","United Kingdom",,,Aylesbury,"EVERY Saturday 0830hrs (onwards)",,,
https://www.afvbc.com/afvbc-uk-breakfast-clubs,"Aylesford & Maidstone Armed Forces & Veterans Breakfast Clubs","+44(0)1622 717251",,https://www.afvbc.com/event/aylesford-armed-forces-veterans-breakfast-club,,,,,https://www.facebook.com/groups/afvbc.aylesford.maidstone,,,,,,,,,,,,,"Malta Inn (Beefeater), Forstal Road, Allington Lock, Sandling","Malta Inn (Beefeater) Forstal Road Allington Lock, Sandling Maidstone, Kent ME14 3AS United Kingdom",51.2958937,0.5078816414,"ME14 3AS","United Kingdom",,,Maidstone,"THIRD Saturday (of the month) 0930hrs (onwards)",,,
https://www.afvbc.com/afvbc-uk-breakfast-clubs,"Ayr Armed Forces & Veterans Breakfast Clubs","+44(0)7377 205972",,https://www.afvbc.com/event/ayr-armed-forces-veterans-breakfast-club,,,,,https://www.facebook.com/groups/afvbc.ayr/,,,,,,,,,,,,,"Nanny Marys Diner, 42 Smith Street","Nanny Marys Diner 42 Smith Street Ayr KA7 1TF United Kingdom",55.45831699,-4.627224952,"KA7 1TF","United Kingdom",,,Ayr,"EVERY Saturday 1000hrs (onwards)",,,
https://www.afvbc.com/afvbc-uk-breakfast-clubs,"Ayrshire (Irvine) Armed Forces & Veterans Breakfast Clubs","+44(0)1294 318486",,https://www.afvbc.com/event/ayrshire-armed-forces-veterans-breakfast-club,,,,,https://www.facebook.com/groups/804615282982632,,,,,,,,,,,,,"The Carrick, 112-114 High Street","The Carrick 112-114 High Street Irvine KA12 8AD United Kingdom",55.61511642,-4.666829109,"KA12 8AD","United Kingdom",,,Irvine,"EVERY Saturday 1000hrs (onwards)",,,
https://www.afvbc.com/afvbc-uk-breakfast-clubs,"Bakewell Armed Forces & Veterans Breakfast Clubs","+44(0)1629 815678",,https://www.afvbc.com/event/bakewell-armed-forces-veterans-breakfast-club,,,,,https://www.facebook.com/groups/1253295205115010/,,,,,,,,,,,,,"The Farmers Feast, The Agricultural Business Centre, Agricultural Way","The Farmers Feast The Agricultural Business Centre Agricultural Way Bakewell DE45 1AH United Kingdom",53.21238732,-1.669127941,"DE45 1AH","United Kingdom",,,Bakewell,"LAST Saturday (of the month) 0900hrs (onwards)",,,
https://www.afvbc.com/afvbc-uk-breakfast-clubs,"Banbury Armed Forces & Veterans Breakfast Clubs","+44(0)1295 259035",,https://www.afvbc.com/event/banbury-armed-forces-veterans-breakfast-club,,,,,https://www.facebook.com/groups/1688571164779925,,,,,,,,,,,,,"The Exchange (Wetherspoon), 49-50 High Street","The Exchange (Wetherspoon) 49-50 High Street Banbury Oxon OX16 5LA United Kingdom",52.06053221,-1.338765621,"OX16 5LA","United Kingdom",,,Banbury,"FIRST Saturday (of the month) 0930hrs (onwards)",,,
https://www.afvbc.com/afvbc-uk-breakfast-clubs,"Bardney Armed Forces & Veterans Breakfast Clubs","+44(0)1526 398005",,https://www.afvbc.com/event/bardney-armed-forces-veterans-breakfast-club,,,,,https://www.facebook.com/groups/afvbc.bardney/,,,,,,,,,,,,,"The Old Angel Inn, 2 Wragby Road, Bardney","The Old Angel Inn 2 Wragby Road Bardney Lincoln LN3 5XE United Kingdom",53.21104849,-0.3242522478,"LN3 5XE","United Kingdom",,,Lincoln,"SECOND & FOURTH Saturday (of the month) 0930hrs (onwards)",,,
https://www.afvbc.com/afvbc-uk-breakfast-clubs,"Barnsley Armed Forces & Veterans Breakfast Clubs","+44(0)1226 292992",,https://www.afvbc.com/event/barnsley-armed-forces-veterans-breakfast-club,,,,,https://www.facebook.com/groups/BarnsleyBreakfastClub,,,,,,,,,,,,,"Manx Arms, 32 Sheffield Road","Manx Arms 32 Sheffield Road Barnsley South Yorkshire S70 1HP United Kingdom",53.54991882,-1.4764181,"S70 1HP","United Kingdom",,,Barnsley,"EVERY Saturday 0930hrs (onwards)",,,
https://www.afvbc.com/afvbc-uk-breakfast-clubs,"Barnstaple Armed Forces & Veterans Breakfast Clubs","+44(0)127 859555",,https://www.afvbc.com/event/barnstaple-armed-forces-veterans-breakfast-club,,,,,https://www.facebook.com/groups/1606971849388587,,,,,,,,,,,,,"The Corner Cafe, 1 Boutport Street","The Corner Cafe 1 Boutport Street Barnstaple Devon EX31 1RH United Kingdom",51.08272797,-4.06161095,"EX31 1RH","United Kingdom",,,Barnstaple,"EVERY Saturday 1030hrs (onwards)",,,
https://www.afvbc.com/afvbc-uk-breakfast-clubs,"Barrow-in-Furness Armed Forces & Veterans Breakfast Clubs","+44(0)1229 471352",,https://www.afvbc.com/event/barrow-in-furness-armed-forces-veterans-breakfast-club,,,,,https://www.facebook.com/groups/afvbc.barrowinfurness,,,,,,,,,,,,,"Ferry Hotel, 1 Promenade, Wainey","Ferry Hotel 1 Promenade Wainey Barrow-in-Furness LA14 3PE United Kingdom",54.1084837,-3.24683547,"LA14 3PE","United Kingdom",,,Barrow-in-Furness,"FIRST Sunday (of the month) 0930hrs (onwards)",,,
https://www.afvbc.com/afvbc-uk-breakfast-clubs,"Barton-upon-Humber Armed Forces & Veterans Breakfast Clubs","+44(0)1652 408445",,https://www.afvbc.com/event/barton-upon-humber-armed-forces-veterans-breakfast-club,,,,,https://www.facebook.com/groups/bartonuponhumber.afvbc/,,,,,,,,,,,,,"Barton Town Cricket Club, Marsh Lane, Barton upon Humber, North Lincolnshire","Barton Town Cricket Club Marsh Lane Barton upon Humber North Lincolnshire DN18 5JD United Kingdom",53.68814931,-0.4357838631,"DN18 5JD","United Kingdom",,,Barton-upon-Humber,"FIRST Sunday (of the month) 0930hrs (onwards)",,,
https://www.afvbc.com/afvbc-uk-breakfast-clubs,"Basildon Armed Forces & Veterans Breakfast Clubs","+44(0)1268 530810",,https://www.afvbc.com/event/basildon-armed-forces-veterans-breakfast-club,,,,,https://www.facebook.com/groups/588286648003150,,,,,,,,,,,,,"The Campenile Hotel, Miles Grey Road, Pipps Hill","The Campenile Hotel Miles Grey Road Pipps Hill Basildon SS14 3AE United Kingdom",51.58432993,0.443379879,"SS14 3AE","United Kingdom",,,Basildon,"SECOND Saturday (of every month) 0900hrs (onwards)",,,
https://www.afvbc.com/afvbc-uk-breakfast-clubs,"Bedale Armed Forces & Veterans Breakfast Clubs",,,https://www.afvbc.com/event/bedale-armed-forces-veterans-breakfast-club,,,,,https://www.facebook.com/groups/176899086335400/,,,,,,,,,,,,,"Bridge Cafe","Bridge Cafe Bedale North Yorkshire DL8 1AN United Kingdom",54.28962294,-1.589659452,"DL8 1AN","United Kingdom",,,Bedale,"EVERY Saturday 1000hrs (onwards)",,,
https://www.afvbc.com/afvbc-uk-breakfast-clubs,"Bedford Armed Forces & Veterans Breakfast Clubs","+44(0)1234 350107",,https://www.afvbc.com/event/bedford-armed-forces-veterans-breakfast-club,,,,,https://www.facebook.com/groups/200269677022888,,,,,,,,,,,,,"RAFA Branch Club, 93 Ashburnham Road","RAFA Branch Club 93 Ashburnham Road Bedford MK40 1EA United Kingdom",52.13817017,-0.4793429375,"MK40 1EA","United Kingdom",,,Bedford,"SECOND Sunday (of every month) 1000hrs (onwards)",,,
https://www.afvbc.com/afvbc-uk-breakfast-clubs,"Bedford (North) Armed Forces & Veterans Breakfast Clubs","+44(0)1234 210359",,https://www.afvbc.com/event/bedford-north-armed-forces-veterans-breakfast-club,,,,,https://www.facebook.com/groups/afvbc.bedford.north/,,,,,,,,,,,,,"North End Social Club, 60 Roff Avenue","North End Social Club 60 Roff Avenue Bedford MK 41 7TW United Kingdom",52.14248308,-0.4734072089,"MK41 7TW  ","United Kingdom",,,Bedford,"FIRST Saturday (of the month) 1030hrs (onwards)",,,
https://www.afvbc.com/afvbc-uk-breakfast-clubs,"Beverley Armed Forces & Veterans Breakfast Clubs","+44(0)1482 886300",,https://www.afvbc.com/event/beverley-armed-forces-veterans-breakfast-club,,,,,https://www.facebook.com/groups/334783994042613,,,,,,,,,,,,,"The Angel, 15 Butcher Row","The Angel 15 Butcher Row Beverley HU17 0AA",53.84191837,-0.4275291,"HU17 0AA","United Kingdom",,,Beverley,"FIRST & THIRD Saturday (of the month) 0900hrs (onwards)",,,
https://www.afvbc.com/afvbc-uk-breakfast-clubs,"Bexley Heath (S/E London) Armed Forces & Veterans Breakfast Clubs","+44(0)20 8850 3663",,https://www.afvbc.com/event/bexley-heath-armed-forces-veterans-breakfast-club,,,,,https://www.facebook.com/groups/966320026787098/,,,,,,,,,,,,,"The Falcon, Lingfield Cres","The Falcon Lingfield Cres London Bexley SE9 2RD United Kingdom",51.45857294,0.08043408394,"SE9 2RD","United Kingdom",,,London,"FIRST Saturday (of the month) 0930hrs (onwards)",,,
https://www.afvbc.com/afvbc-uk-breakfast-clubs,"Biggar Armed Forces & Veterans Breakfast Clubs","+44(0)1899 220009",,https://www.afvbc.com/event/biggar-armed-forces-veterans-breakfast-club,,,,,https://www.facebook.com/groups/afvbc.biggar/,,,,,,,,,,,,,"Aroma Cafe Biggar, 86 High Street","Aroma Cafe Biggar 86 High Street Biggar South Lanarkshire ML12 6DH United Kingdom",55.62419796,-3.523534834,"ML12 6DH","United Kingdom",,,Biggar,"FRIST Tuesday (of the month) 1000hrs (onwards)",,,
https://www.afvbc.com/afvbc-uk-breakfast-clubs,"Biggin Hill Armed Forces Veterans Breakfast Clubs","+44(0)1959 571676",,https://www.afvbc.com/event/biggin-hill-armed-forces-veterans-breakfast-club,,,,,https://www.facebook.com/groups/853791458066313,,,,,,,,,,,,,"The Spitfire Cafe, 154A Main Road, Biggin Hill","The Spitfire Cafe 154A Main Road Biggin Hill TN16 3BA United Kingdom",51.31012741,0.03611326218,"TN16 3BA","United Kingdom",,,Westerham,"SECOND Tuesday (of the month) 0930hrs (onwards)",,,
https://www.afvbc.com/afvbc-uk-breakfast-clubs,"Biggleswade Armed Forces & Veterans Breakfast Clubs","+44(0)1767 314219",,https://www.afvbc.com/event/biggleswade-armed-forces-veterans-breakfast-club,,,,,https://www.facebook.com/groups/361185867658553/,,,,,,,,,,,,,"The White Hart, 22-24 Market Square","The White Hart 22-24 Market Square Biggleswade Bedfordshire SG18 8AR United Kingdom",52.08658422,-0.26312055,"SG18 8AR","United Kingdom",,,Biggleswade,"THIRD Saturday (of the month) 1000hrs (onwards)",,,
https://www.afvbc.com/afvbc-uk-breakfast-clubs,"Billingborough Armed Forces & Veterans Breakfast Clubs","+44(0)1529 240228",,https://www.afvbc.com/event/billingborough-armed-forces-veterans-breakfast-club,,,,,https://www.facebook.com/groups/billingborough.afvbc/,,,,,,,,,,,,,"Fortescue Arms, 27 High Street, Billingborough, Lincolnshire","Fortescue Arms 27 High Street Billingborough Lincolnshire NG34 0QB United Kingdom",52.89279344,-0.3417804837,"NG34 0QB","United Kingdom",,,Sleaford,"FIRST Saturday (of the month) 1000hrs (onwards)",,,
https://www.afvbc.com/afvbc-uk-breakfast-clubs,"Bingham & District Armed Forces Veterans Breakfast Clubs","+44(0)1949 863100",,https://www.afvbc.com/event/bingham-district-armed-forces-veterans-breakfast-club,,,,,https://www.facebook.com/groups/172206680221378,,,,,,,,,,,,,"The Butter Cross (Wetherspoon), Market Place, Bingham, Nottinghamshire","The Butter Cross (Wetherspoon) Market Place Bingham Nottinghamshire NG13 8AP United Kingdom",52.95250346,-0.9517014027,"NG13 8AP","United Kingdom",,,Nottingham,"FIRST Saturday (of the month) 0900hrs (onwards)",,,
https://www.afvbc.com/afvbc-uk-breakfast-clubs,"Birmingham Armed Forces & Veterans Breakfast Clubs",,,https://www.afvbc.com/event/birmingham-city-armed-forces-veterans-breakfast-club,,,,,https://www.facebook.com/groups/1691567874441286,,,,,,,,,,,,,"Weoley Castle Inn, 112 Shenley Lane","Weoley Castle Inn 112 Shenley Lane Birmingham B29 5LX United Kingdom",52.43255848,-1.974760294,"B29 5LX","United Kingdom",,,Birmingham,"FIRST Saturday (of the month) 0930hrs (onwards)",,,
https://www.afvbc.com/afvbc-uk-breakfast-clubs,"Birmingham (North) Armed Forces & Veterans Breakfast Clubs","+44(0)121 357 1148",,https://www.afvbc.com/event/birmingham-north-armed-forces-veterans-breakfast-club,,,,,https://www.facebook.com/groups/284567439083204/,,,,,,,,,,,,,"The Malt Shovel, Newton Road, Great Barr","The Malt Shovel Newton Road Great Barr Birmingham B43 6HN United Kingdom",52.54314347,-1.955795735,"B43 6HN","United Kingdom",,,Birmingham,"THIRD Saturday (of the month) 1000hrs (onwards)",,,
https://www.afvbc.com/afvbc-uk-breakfast-clubs,"Bishop's Stortford Armed Forces & Veterans Breakfast Clubs","+44(0)1279 714460",,https://www.afvbc.com/event/bishops-stortford-armed-forces-veterans-breakfast-club,,,,,https://www.facebook.com/groups/afvbc.bishop.stortford,,,,,,,,,,,,,"The Port Jackson, Riverside Wharf, Ground Floor Units D1/D2, Block D, Riverside","The Port Jackson Riverside Wharf Ground Floor Units D1/D2, Block D Riverside, Bishop's Stortford CM23 3GN United Kingdom",51.86911837,0.1617157459,"CM23 3GN","United Kingdom",,,"Bishop's Stortford","FIRST & THIRD Sunday (of the month) 0930hrs (onwards)",,,
https://www.afvbc.com/afvbc-uk-breakfast-clubs,"Bishops Cleeve Armed Forces & Veterans Breakfast Clubs","+44(0)1242 672664",,https://www.afvbc.com/event/bishops-cleeve-armed-forces-veterans-breakfast-club,,,,,https://www.facebook.com/groups/bishops.cleve.afvbc/,,,,,,,,,,,,,"Royal Oak, Church Road, Bishops Cleeve","Royal Oak Church Road Bishops Cleeve Cheltenham GL52 8LR United Kingdom",51.94714168,-2.059799731,"GL52 8LR","United Kingdom",,,Cheltenham,"SECOND Saturday (of the month) 0930hrs (onwards)",,,
https://www.afvbc.com/afvbc-uk-breakfast-clubs,"Blackburn & Darwen Armed Forces & Veterans Breakfast Clubs","+44(0)11254 292000 (Youth Zone - Venue Telephone Number)",,https://www.afvbc.com/event/blackburn-darwen-armed-forces-veterans-breakfast-club,,,,,https://www.facebook.com/groups/419766861737478/,,,,,,,,,,,,,"Blackburn Youth Zone, Jubilee Street","Blackburn Youth Zone Jubilee Street Blackburn BB1 1EP United Kingdom",53.74550048,-2.481386662,"BB1 1EP","United Kingdom",,,Blackburn,"FIRST & LAST Sunday (of the month) 1100hrs - 1300hrs / 1000hrs - 1200hrs",,,
https://www.afvbc.com/afvbc-uk-breakfast-clubs,"Blackpool Armed Forces & Veterans Breakfast Clubs","+44(0)1253 394702",,https://www.afvbc.com/event/blackpool-armed-forces-veterans-breakfast-club,,,,,https://www.facebook.com/groups/afvbc.blackpool/,,,,,,,,,,,,,"The Belle Vue, Whitefgate Drive","The Belle Vue Whitefgate Drive Blackpool FY3 9DQ United Kingdom",53.81599798,-3.036421537,"FY3 9DQ","United Kingdom",,,Blackpool,"EVERY Saturday 1000hrs (onwards)",,,
https://www.afvbc.com/afvbc-uk-breakfast-clubs,"Blandford Armed Forces & Veterans Breakfast Clubs","+44(0)7368 339083",,https://www.afvbc.com/event/blandford-armed-forces-veterans-breakfast-club,,,,,https://www.facebook.com/groups/2180384978659329,,,,,,,,,,,,,"Clubhouse 1896, Ashley Wood Golf Club","Clubhouse 1896 Ashley Wood Golf Club Blandford Forum Dorset DT11 9HN United Kingdom",50.85813925,-2.120822668,"DT11 9HN","United Kingdom",,,"Blandford Forum","FIRST Saturday (of the month) 1000hrs (onwards)",,,
https://www.afvbc.com/afvbc-uk-breakfast-clubs,"Bodmin Armed Forces & Veterans Breakfast Clubs","+44(0)1208 831212",,https://www.afvbc.com/event/bodmin-armed-forces-veterans-breakfast-club,,,,,https://www.facebook.com/groups/287803025075012,,,,,,,,,,,,,"The Lanivet Inn, Truro Road, Lanivet","The Lanivet Inn Truro Road Lanivet Bodmin, Cornwall PL30 5ET United Kingdom",50.44466797,-4.76475045,"PL30 5ET","United Kingdom",,,Bodmin,"THIRD Saturday (of the month) 1000hrs (onwards)",,,
https://www.afvbc.com/afvbc-uk-breakfast-clubs,"Bognor Regis Armed Forces & Veterans Breakfast Clubs","+44(0)7728 760246",,https://www.afvbc.com/event/bognor-regis-armed-forces-veterans-breakfast-club,,,,,https://www.facebook.com/groups/1298780123856685,,,,,,,,,,,,,"Laburnum Centre & Gym (AGE UK), Lyon St","Laburnum Centre & Gym (AGE UK) Lyon St Bognor Regis PO21 1UX United Kingdom",50.78560682,-0.6724037,"PO21 1UX","United Kingdom",,,"Bognor Regis","EVERY Tuesday 0930hrs - 1130hrs",,,
https://www.afvbc.com/afvbc-uk-breakfast-clubs,"Bolton Armed Forces & Veterans Breakfast Clubs","+44(0)7592 449723",,https://www.afvbc.com/event/bolton-armed-forces-veterans-breakfast-club,,,,,https://www.facebook.com/groups/1239706262788828/,,,,,,,,,,,,,"A & J's Café, Eagle Street, Haulgh","A & J's Café,  Eagle Street Haulgh Bolton BL2 2BU United Kingdom",53.57966917,-2.4195883,"BL2 2BU","United Kingdom",,,Bolton,"EVERY Saturday 1030hrs (onwards)",,,
https://www.afvbc.com/afvbc-uk-breakfast-clubs,"Bootle Armed Forces & Veterans Breakfast Clubs","+44(0)1512 943007",,https://www.afvbc.com/event/bootle-armed-forces-veterans-breakfast-club,,,,,https://www.facebook.com/groups/bootle.afvbc,,,,,,,,,,,,,"PSI Global Training, Unit 10, D B R Business Park, Dunnings Bridge Road","PSI Global Training Unit 10 D B R Business Park Dunnings Bridge Road L30 6AA United Kingdom",53.48338927,-2.960972339,"L30 6AA","United Kingdom",,,Bootle,"SECOND Thursday (of the month) 1000hrs - 1200hrs",,,
https://www.afvbc.com/afvbc-uk-breakfast-clubs,"Bordon Armed Forces & Veterans Breakfast Clubs","+44(0)1420 555970",,https://www.afvbc.com/event/bordon-armed-forces-veterans-breakfast-club,,,,,https://www.facebook.com/groups/591259874590908,,,,,,,,,,,,,"CafÃ© 1759, Chieftain House, Challenger Place","CafÃ© 1759 Chieftain House Challenger Place GU35 0FP United Kingdom",51.11811828,-0.8592939377,"GU35 0FP","United Kingdom",,,Bordon,"FIRST Tuesday & THIRD Saturday (of every month) 0900hrs (onwards)",,,
https://www.afvbc.com/afvbc-uk-breakfast-clubs,"Boston Armed Forces & Veterans Breakfast Clubs","+44(0)1205 356678",,https://www.afvbc.com/event/boston-armed-forces-veterans-breakfast-club,,,,,https://www.facebook.com/groups/afvbc.boston/,,,,,,,,,,,,,"Spirit Of Endeavour, Marsh Lane","Spirit Of Endeavour Marsh Lane Boston PE21 7QS United Kingdom",52.96473138,-0.02661824226,"PE21 7QS","United Kingdom",,,Boston,"EVERY Saturday 0900hrs (onwards)",,,
https://www.afvbc.com/afvbc-uk-breakfast-clubs,"Bourne Armed Forces & Veterans Breakfast Clubs","+44(0)1778 393644",,https://www.afvbc.com/event/bourne-armed-forces-veterans-breakfast-club,,,,,https://www.facebook.com/groups/590433321121555,,,,,,,,,,,,,"The Nags Head, 2 Abbey Road","The Nags Head 2 Abbey Road Bourne Lincs PE10 9EF United Kingdom",52.76794807,-0.37688555,"PE10 9EF","United Kingdom",,,Bourne,"Every Saturday 1000hrs (onwards)",,,
https://www.afvbc.com/afvbc-uk-breakfast-clubs,"Braintree Armed Forces & Veterans Breakfast Clubs","+44(0)1376 741604",,https://www.afvbc.com/event//braintree-armed-forces-veterans-breakfast-club,,,,,https://www.facebook.com/groups/588611251294706,,,,,,,,,,,,,"The Pub, East Street","The Pub East Street Braintree Essex CM7 3JJ United Kingdom",51.87752423,0.5630922318,"CM7 3JJ","United Kingdom",,,Braintree,"SECOND Saturday (of the month) 1000hrs (onwards)",,,
